name,ASIN,Brand,Best_Sellers_Rank,Best_Sellers_Ranking_Fields,Product_Dimensions_inches,Item_Weight_pounds,Date_First_Available,Is_Discontinued_By_Manufacturer,Item_model_number,Batteries,Voltage,Series,National_Stock_Number,Chipset_Brand,Batteries_Required,Wireless_Type,Standing_screen_display_size,Max_Screen_Resolution,Part_Number,Item_Package_Quantity,Color,Number_of_USB_2point0_Ports,Number_of_USB_3point0_Ports,Computer_Memory_Type,Average_Battery_Life_in_hours,Processor_Count
"2.4G Wireless Ergonomic Vertical Mouse, DOOMIER Rechargeable Ergonomic Vertical Cordless Optical Mice with USB Receiver, 6 Buttons 3 DPI 1000/1200/1600 for Desktop, Laptop, Chromebook, Black",B08974HYGF,,515,Computer,4.6 x 2.7 x 3.9,0.5376,2019-11-12,,mmplverticalrechargemouse,1 Lithium Polymer batteries required.,,,,,,,,,,,,,,,,
"BZseed RGB Gaming Mouse Pad X Large, Black Extended LED Mouse Pad 30% Larger Size(31.5""×11.8""), Anti-Slip Base Computer Keyboard Mouse Mat for Gaming Computer/Laptops/Office Desk",B07Y85JBDV,BZseed,3852,Office,31.5 x 11.8 x 0.2,1.57,2019-10-17,,,,,,,,,,,,,,Black,,,,,
"HP USB 3 Button Optical Mouse (KY619AA#ABA),black",B0029L0IM8,,346,Computer,4.53 x 2.5 x 1.38,0.64,2009-05-11,No,KY619AA#ABA,,,,,,,,,,,,,,,,,
"ZLOT Vertical Gaming Mouse,Wired RGB Ergonomic USB Joystick Programmable Laser Gaming Mice,6+1 Design,11 Buttons,1000 Hz Max Polling Rate,10000 Max DPI,2019 Upgraded Version for Computer Gamers,Black",B07T3PFWCB,,1633,Video,4.33 x 2.83 x 3.01,1.1840000000000002,2019-06-14,No,G19C18,,,,,,,,,,,,,,,,,
Mouse Pads Black Background Red Color Paint Explosion Burst Red Black Rectangle 240x200x3mm at Colored Cases Store,B00X6XWBGY,Mouse Pads,9084,Office,11.5 x 1.1 x 5.8,0.1536,2015-05-06,Yes,HN-QK-369,,,,,,,,,,,,Black Red,,,,,
"MROCO Large Gaming Mouse Pad Pack with Stitched Edges, Non-Slip Rubber Base, Premium-Textured, Waterproof Mousepad Bulk Mouse Mat Mouse Pads for Gamer, Computer & PC, 12.6 x 10.8 x 0.12 inches, Black",B07DFKSNTP,,4023,Office,12.6 x 10.8 x 0.12,0.9440000000000001,2018-07-31,No,MROCO-BLACK-MOUSE-PAD-GAMING-L,,,,,,,,,,,,,,,,,
"Mouse Pad with Wrist Rest Support, Custom Original Memory Foam Wrist Rest Pad Non-Slip Ergonomic Desk Gaming Mouse Mat for Home & Office (Marble Pink Purple)",B085WN25NK,Nasdalgias,15949,Office,9.9 x 9 x 0.9,0.6368,2020-03-14,,,,,,,,,,,,,,Marble Pink Purple,,,,,
"2.4GHz Wireless Bluetooth Mouse, Jelly Comb Dual Mode Slim Wireless Mouse with 2400 DPI Compatible for PC, Laptop, Mac, Android, Windows (Black)",B07DMGKSN2,,189,Computer,4.6 x 2.6 x 1.6 ,0.2816,2018-07-06,No,8541666517,,,,,,,,,,,,,,,,,
Perixx PERIMICE-209 3 Button USB Wired Mouse - Optical - 1000 DPI - 5.9 Ft Cable - Black,B074W6Z6LW,Perixx,5594,Video,4.29 x 2.34 x 1.48,0.5632,2017-08-17,No,PERIMICE-209,,,,,,,,,,,,,,,,,
"Wired Keyboard and Mouse, Jelly Comb Ultra Thin Full Size USB Wire Corded Keyboard Mouse Combo Set with Number Pad for Computer, Laptop, PC, Desktop, Notebook, Windows 7, 8, 10 (Black)",B07PMKK5H4,,83,Computer,17.13 x 4.8 x 0.6,2.272,2019-03-04,,,,,,,,,,,,,,,,,,,
"Smooffly Polka Dot Mouse Pad, Polka Dot Print, Dot Pattern, Gift for Her, Cute Round Mousepad, Cute Desk Accessories, Office Decor, Desk Decor, Mouse Pads",B07TPFPNFV,Smooffly,3697,Office,7.87 x 7.87 x 0.12,0.2528,2019-06-30,,SMGM-MP6560,,,,,,,,,,,,Gmr60,,,,,
"Wireless Keyboard and Mouse Combo Silent, RATEL 2.4GHz Ultra-Thin Full Sized Wireless Keyboard Mouse Set with USB Receiver for Computer, Desktop, PC, Notebook, Laptop (Black)",B07XNNLN9N,,18,Computer,16.13 x 4.7 x 0.8,2.09,2019-09-09,,,,,,,,,,,,,,,,,,,
"Glorious Model O Gaming Mouse, Matte White (GO-White)",B07MGDRBBF,,1606,Video,5.04 x 2.6 x 1.48,0.3776,2019-01-13,No,GO-WHITE,,,,,,,,,,,,,,,,,
Memory Foam Mouse Pad Mat with Wrist Rest (Black),B0002H1K0K,,5597,Office,9 x 1 x 8,1.28,2001-10-02,No,59107,,,,,,,,,,,,,,,,,
"Laptop Mouse Pad with Stitched Edge, Micro-woven Mouse Mat with Non-Slip Rubber Base, Waterproof Mousepad for Computer, Laptop, Desktop, Gaming, Office,Premium-Textured Mouse Pads for All Type of Mice",B0892ZFSYL,CORNER ZONE,21712,Office,10.3 x 8.5 x 0.2 ,0.6368,2020-06-30,,,,,,,,,,,,,,BLACK,,,,,
Anime Mouse Pad Gaming Mouse Pad Mouse Mat for Office Supplies 9.8x11.8x0.12inch,B0892DJ1VJ,Easterm,24703,Office,11.73 x 9.84 x 0.39 ,0.736,2020-05-22,,,,,,,,,,,,,,,,,,,
"Macally USB Wired Computer Mouse with 3 Button, Scroll Wheel, 5 Foot Long Corded, Compatible with Windows PC, Apple Macbook Pro/Air, iMac, Mac Mini, Laptops (White)",B07FTKQ97Q,Macally,449,Computer,6.5 x 2.5 x 1.2,0.768,2018-07-23,No,XMOUSE,,,,,,,,,,,,White with Gray Trim,,,,,
"JITOPKEY Wireless Mouse, 2.4Ghz Comfortable Click Mouse with USB Receiver, High Precise Tracking Cordless Portable Computer Mouse for Laptop, Chromebook, MacBook, Notebook, PC (Blue)",B08C7VZDZ7,,1257,Computer,3.9 x 1.96 x 1.18,0.33280000000000004,2020-07-02,No,JT-M106,,,,,,,,,,,,,,,,,
Macally USB Wired Computer Mouse - Simple 3 Button & Scroll Wheel Design - Ergonomic & Easy to Use Corded Mouse USB - Compatible with Windows & Apple - Plug & Play Wired Mouse for Laptop or Desktop,B07FSSYKVM,,525,Computer,4.3 x 6.5 x 1.3,0.64,2018-07-23,No,QMOUSE,,,,,,,,,,,,,,,,,
"SteelSeries Sensei 310 Gaming Mouse - 12,000 CPI TrueMove3 Optical Sensor - Ambidextrous Design - Split-Trigger Buttons - RGB Lighting, Black",B073WGB8G6,SteelSeries,1369,Video,4.93 x 2.77 x 1.53,0.5632,2017-08-01,No,62432,,,62432,,,,,,,,,Black,,,,,
Macally 2.4G Wireless Mouse (Optical) with USB Cordless Mice Receiver - Long Range & Portable - Works with Mac Mini/Apple MacBook Pro/Air or Windows PC Notebook Laptops & Desktop Computers - White,B07NSG8W58,,277,Computer,4 x 2.4 x 1.6,0.512,2019-02-15,,RFXMOUSE,1 AA batteries required. (included),,,,,,,,,,,,,,,,
Logitech G PRO Wireless Gaming Mouse - Shroud Edition,B08DYY16J6,Logitech G,156,Computer,6.77 x 2.65 x 4.53,0.44799999999999995,2020-09-15,,910-005974,1 Lithium Polymer batteries required. (included),,,,,,,,,,,,,,,,
"RGB Gaming Mouse Pad with 11 RGB Light up Modes,LED Gaming Pad,Non-Slip Rubber Based Computer Mice mat Medium Size(13.7” x 10.3”)",B07R6KMTFN,,1720,Video,13.7 x 10.3 x 0.12,1.4080000000000001,2019-04-28,,,,,,,,,,,,,,,,,,,
"Purple Butterfly Customized Rectangle Mousepad, Mouse Pad",B00MILIOKM,VOSARIY,5787,Office,11.5 x 1.1 x 5.8,0.1536,2014-08-08,No,ntfdfh,,,,,,,,,,,,Purple,,,,,
"Mouse Pad, Custom Cute Unicorn with Blue Stars Mousepads, Premium-Textured Mouse Mat, Non-Slip Rubber Base Mousepad for Laptop, Computer & PC, 9.5x7.9x0.12 inches",B087RLL9QT,Colinden,14867,Office,9.5 x 7.9 x 0.1,0.3824,2020-04-28,,,,,,,,,,,,,,A-a,,,,,
"LeadsaiL Computer Wireless Mouse, 2.4G Wireless Ergonomic Portable Mobile Mouse, Cordless Mouse with USB Receiver, 3 Adjustable DPI Levels for Notebook, PC, Laptop, Computer, MacBook (Red)",B087Q719JY,,365,Computer,3.94 x 1.97 x 1.18,0.42240000000000005,2020-04-27,,,,,,,,,,,,,,,,,,,
"Galaxy Round Mouse Pad by Smooffly,Blue Purple Galaxy Customized Round Non-Slip Rubber Mousepad Gaming Mouse Pad 7.87""X7.87"" inch",B079NV9YNC,,17275,Office,7.87 x 7.87 x 0.12,0.12960000000000002,2018-02-08,No,8541655447,,,,,,,,,,,,,,,,,
"RGB Gaming Mouse Pad, 14 Lights Modes with 4 USB Ports Ultra-Large Size Soft Extra Extended Mousepad, Anti-Slip Rubber Base Computer Keyboard Mat 31.5X 11.8in",B077HTGQ51,,9925,Office,12.6 x 3.9 x 3.86 ,1.76,2020-08-18,,,,,,,,,,,,,,,,,,,
"Auhoahsil Gaming Mouse Pad, Square Outer Space Theme Anti-Slip Rubber Mousepad with Stitched Edge for Office Laptop Computer PC Men Women Kids, Custom Pattern, 9.8 x 9.8 in, Mysterious Galaxy Design",B08JTDKR1J,Auhoahsil,13366,Office,14.53 x 8.19 x 0.28 ,0.672,2020-09-23,,,,,,,,,,,,,,Mysterious Galaxy,,,,,
"Type C Wireless Mouse, Jelly Comb 2.4GHz Wireless Mouse with 2 in 1 USB and Type C Receiver Compatible with PC, Laptop, MacBook, MacBook Pro - White and Silver",B083B7HBC7,,710,Computer,6.3 x 4.13 x 1.77 ,0.6032000000000001,2019-12-31,,,,,,,,,,,,,,,,,,,
"Wired Lightweight Gaming Mouse , 6400DPI Backlit Mice with 7 Buttons Programmable Driver,Ultralight Honeycomb Shell Ultraweave Cable Mouse for PC Gamers and Xbox and PS4 Users(Red)",B08JPLKMGM,,3907,Video,6.06 x 4.09 x 2.09 ,0.8959999999999999,2020-09-22,,,,,,,,,,,,,,,,,,,
Logitech Wireless Mouse M310 (Flame Red),B004ZEZB88,,495,Computer,8.82 x 3.62 x 6.46,0.768,2011-06-01,No,910-002486,1 AA batteries required. (included),,,,,,,,,,,,,,,,
"Insten Premium Leather Mouse Pad with Waterproof Coating, Non Slip & Elegant Stitched Edges, Black",B01E9V515O,INSTEN,12747,Office,8.66 x 7.09 x 0.12,0.35840000000000005,2016-04-15,No,2208903,,,,,,,,,,,,[Leather Mouse Pad] Black,,,,,
3Dconnexion 3DX-700066 Spacemouse Wireless (with Carry Case and Universal Receiver),B079V367MM,3DConnexion,358,Computer,3.07 x 3.07 x 2.09,1.23,2018-02-14,No,3DX-700066,1 Lithium Polymer batteries required. (included),5 Volts,,,,,,,,,,,,,,,
"Auhoahsil Mouse Pad, Square Outer Space Mousepad Anti-Slip Rubber Mouse Mat with Durable Stitched Edge for Office Gaming Laptop Computer PC Men Women Kids, 11.8 x 9.8 in, Custom Galaxy & Stars Design",B088TX6V82,Auhoahsil,7139,Office,11.8 x 9.85 x 0.24,0.8959999999999999,2020-05-19,,,,,,,,,,,,,,Marvelous Galaxy,,,,,
"Verbatim Wireless Silent Mouse 2.4GHz with Nano Receiver - Ergonomic, Blue LED, Noiseless and Silent Click for Mac and Windows - Blue",B075FSW3S8,Verbatim,1379,Computer,3.7 x 2.3 x 1.4,0.33280000000000004,2017-09-07,No,99770,2 AAA batteries required. (included),,Silent,,,,,,,,,Blue,,,,,
"Amcove Gaming Mouse Pad Custom, Stay Positive Work Hard and Make It Happen Inspirational Quotes Mouse pad Art Rose Gold and Silver Glitter Black Quote",B08CZN895J,Amcove,10261,Office,9.45 x 7.87 x 0.12,0.4736,2020-07-15,,Amcove-MP-3134,,,,,,,,,,,,Am06,,,,,
Colorful Flower Petals Round Mouse Pad Personalized Design Cute Mouse Pad Small Size Non-Slip Rubber Mouse Pads for Computer Laptop,B08P5L9W8G,IMAYONDIA,10048,Office,7.9 x 7.9 x 0.12,0.05072,2020-11-27,,,,,,,,,,,,,,Flower Petals,,,,,
"Gaming Mouse Pad, Canjoy Extended Mouse Pad, XXL Large Big Computer Keyboard Mouse Mat Desk Pad with Non-Slip Base and Stitched Edge for Home Office Gaming Work, 31.5x15.7x0.12inch, Galaxy Print",B08P1WH5D2,,7942,Office,16.3 x 2.36 x 2.01 ,2.432,2020-11-23,,,,,,,,,,,,,,,,,,,
WiebeTech Programmable Mouse Jiggler MJ-3 (Single Unit),B00MTZY7Y4,,211,Computer,0.8 x 0.6 x 0.3,0.0512,2017-10-21,No,30200-0100-0013,,,,,,,,,,,,,,,,,
"OMOTON Bluetooth Keyboard and Mouse for iPad and iPhone (iPadOS 13 / iOS 13 and Above), Compatible with New iPad 10.2, iPad Pro 12.9/11.0, and Other Bluetooth Enabled Devices, Silver White",B08244KDL1,,105,Computer,13.74 x 4.72 x 1.18,1.8719999999999999,2019-11-28,,,2 AAA batteries required.,,,,,,,,,,,,,,,,
"GIM Mouse pad, Memory Foam Mouse Wrist Rest Support Cushion with Non Slip Rubber Base for Laptop, Computer, Gaming, Office",B083TDP9C5,,14866,Office,8.5 x 8 x 0.6 ,0.8640000000000001,2020-02-15,,,,,,,,,,,,,,,,,,,
"Psitek 36x16 Inches XXL Large Gaming Mouse Pad Extended Desk Keyboard Mousepad, Waterproof Cloth Surface Optimized for Precision, Durable Stitched Anti-Fray Edges Green",B08KVVQZQ6,,6164,Office,36 x 16 x 0.12,1.5,2020-10-08,No,Green3616,,,,,,,,,,,,,,,,,
Fort Nite Gaming Mouse Pad Waterproof Extended and Non-Slip Mouse Pads for Computers,B07WR4KQX4,Almighty Store,25667,Office,9.84 x 11.81 x 0.12,0.6368,2019-08-18,,gaming series 3,,,,,,,,,,,,Gaming Series 3,,,,,
"RGB Gaming Large Mouse pad,YCYCSY Professional LED Extended Black Mouse Pad,Extra Long Computer Keyboard Mouse Pads, Anti-Slip Rubber Base,Waterproof Keyboard Mouse Mat with 14 Lighting Modes",B07PRV5HW9,,8644,Office,31.5 x 11.8 x 0.2,1.5,2019-03-14,,mousepad001,,,,,,,,,,,,,,,,,
"Bluetooth Wireless Mouse for Mac/iPad OS 13/MacBook pro/Desktop/Laptop,Wireless Mouse for MacBook Air/Windows Linux/Notebook 2.4GHz Rechargeable Dual Mode Slim Wireless Mouse Silent USB Mice",B07YZMFF9Q,,434,Computer,4.76 x 2.8 x 1.46 ,0.8,2019-10-11,,,1 Lithium Polymer batteries required. (included),,,,,,,,,,,,,,,,
"Ergonomic Wireless Mouse Cool Iron Man Mouse 2.4 G Portable Mobile Computer Click Silent Mouse Optical Mice with USB Receiver, Multi-Color Choosing for Notebook PC Laptop Computer Mac Book (Gold)",B085XX9XNL,,195,Computer,4.92 x 3.31 x 1.81 ,0.3936,2020-03-16,,,,,,,,,,,,,,,,,,,
"Bluetooth Mouse, Jelly Comb Rechargeable 2.4GHz Bluetooth Ergonomic Wireless Mouse (BT4.0+BT4.0+2.4G) Switch to 3 Devices for Mac OS MacBook Air Windows PC Android Tablet-(White and Silver)",B07Y66L5SR,Jelly Comb,368,Computer,4.54 x 3.03 x 1.58,0.8959999999999999,2019-09-21,,,,,,,,,,,,,,Silver and White,,,,,
"Wireless Mouse, WisFox 2.4G Silent Wireless Bluetooth Mouse, 3 Modes (Bluetooth 5.0/3.0 + USB), Portable Wireless Computer Mouse Ergonomic Mouse for Laptop Desktop Windows Mac iPad",B086HKCHV4,,353,Computer,4.49 x 2.56 x 1.46 ,0.2816,2020-03-28,,,,,,,,,,,,,,,,,,,
"Perixx Perimice-209 P, Wired PS2 Mouse with 1000 DPI Resolution, Black",B07WV55HZD,Perixx,145,Computer,4.33 x 2.24 x 1.5,0.5648,2019-08-23,,10442,,,PM-209PB-10442,,,,,,,,,Black,,,,,
"TUNJILOOL 2 in 1 Double-Sided Round Mouse Pad Waterproof PU Leather 220x220x22mm Protective Writing Pad, Suitable for Office Home(Light Blue/Silver)",B08P8PR6GN,TUNJILOOL,43595,Office,10.28 x 8.62 x 0.12 ,0.2752,2020-12-07,,,,,,,,,,,,,,Light Blue/Silver,,,,,
"Pro Gaming Mouse Pad (5mm) | Traverse Ridge Massive 46 inch | 46x17.3x0.20 Extra Thick | Black/Black | Dense Weave Speed Poly, Superior Control | Stitched Edge, Washable, Giant Large Desk Mat",B08RY7FQR1,,51955,Office,46 x 17.3 x 0.2,3.2,2018-10-06,,,,,,,,,,,,,,,,,,,
"Lightweight Gaming Mouse, Honeycomb Design Rechargeable Wireless Gaming Mouse with USB Receiver RGB Backlight Computer Mouse for Laptop PC (White)",B08DWR9LWC,,3436,Video,4.72 x 2.76 x 1.97,0.5648,2020-07-30,,BM600,,,,,,,,,,,,,,,,,
"Razer Goliathus Extended Chroma Gaming Mousepad: Customizable Chroma RGB Lighting, Soft, Cloth Material, Balanced Control & Speed, Non-Slip Rubber Base, Classic Black",B07DG64YL9,Razer,2001,Office,11.58 x 36.25 x 0.12,1.23,2018-06-19,No,RZ02-02500300-R3U1,,,,,,,,,,,,Classic Black,,,,,
"Multi-Device Ergonomic Mouse, seenda Rechargeable Bluetooth Vertical Mouse Switch to 3 Devices, Comfortable Silent Wireless Mouse for Laptop, Windows, MacBook Pro/Air, iPad, Android, Black",B08LB3SN4P,,717,Computer,4.3 x 2.8 x 3.8,0.672,2020-10-17,,IWG-SGM01,,,,,,,,,,,,,,,,,
"NPET M70 Wired Gaming Mouse, 7200 DPI, 7 Programmable Buttons, LED Backlit, Ergonomic Optical PC, Comfortable Computer Gaming Mice for Windows 7/8/10/XP Vista Linux, Black",B07S46TJGV,,1775,Video,5.02 x 2.66 x 1.61,0.96,2019-01-01,No,M70,,,,,,,,,,,,,,,,,
"Dell KM717 Premier Wireless Keyboard and Mouse, Gray",B01M04JXS3,Dell,75,Computer,16.91 x 4.57 x 0.91,2.208,2016-09-13,No,KM717,2 AAA batteries required. (included),,KM717,,,,,,,,,Gray,,,,,
"HEVITDA Mouse Pad, Ergonomic Mouse Pad with Wrist Support, Pain Relief Comfort Wrist Rest Pad with Non-Slip PU Base for Gaming, Home, Office & Travel, Beach",B08CXVW3M1,HEVITDA,11892,Office,8.75 x 7.2 x 0.7,0.8959999999999999,2020-07-16,,,,,,,,,,,,,,Beach,,,,,
"JEDIA Mouse Mover Jiggler, Mouse Mover USB Port with ON/Off Switch for Computer Laptop, Mouse Jiggler with Indicator Light to Prevent Computer from Hibernation Mode",B08LPTDW6T,,990,Computer,5.71 x 3.78 x 0.67 ,0.1808,2020-10-23,,,,,,,,,,,,,,,,,,,
Razer Pro Click Humanscale Wireless Mouse: Ergonomic Form Factor - 5G Advanced Optical Sensor - Multi-Host Connectivity - 8 Programmable Buttons - Extended Battery Life of up to 400 Hours,B08BQXL6DD,Razer,545,Computer,4.99 x 3.14 x 1.8,0.848,2020-08-27,,RZ01-02990100-R3U1,1 Lithium ion batteries required. (included),,,,,,,,,,,,,,,,
"PCCOOLER RGB Gaming Mouse Pad, Soft and Large Mouse pad with 14 Lighting Modes 2 Brightness Levels, Non-Slip Rubber Base RGB Mouse Pad for Computer Keyboard，31.5X 11.8in( 800 x 300mm)",B08M8P8C66,PCCOOLER,18980,Office,31.5 x 11.8 x 0.16,1.54,2021-01-01,No,TMP-31.5in,,,,,,,,,,,,Rgb,,,,,
"Bluetooth Mouse,Slim Rechargeable Dual Mode(Bluetooth 4.0 + USB) 2.4GHz Wireless Bluetooth Mouse,3 Adjustable DPI,Compatible for MacBook, Laptop, iPad, PC,Computer (Pink)",B07ZNNL8LX,,465,Computer,5 x 3.1 x 1.4 ,0.3408,2019-10-27,,,1 Product Specific batteries required. (included),,,,,,,,,,,,,,,,
"FPSMOUPD Extended Gaming Mouse Pad with Stitched Edges, Akatsuki Clan Large Mousepad with Non-Slip Rubber Base for Work & Gaming, Office & Home, 31.5x11.8x0.12inch",B08912G8BR,,21373,Office,12.09 x 11.54 x 1.46 ,2.416,2020-05-23,No,,,,,,,,,,,,,,,,,,
Logitech G604 Lightspeed Wireless Gaming Mouse,B07QN369XX,Logitech G,208,Video,1.77 x 3.14 x 5.11,1.472,2019-09-16,,910-005622,1 AA batteries required. (included),,Logitech G604 Lightspeed Wireless Gaming Mouse,,,,,,,,,,,,,,
"Iron Man Mouse, Wireless Computer Mouse 2.4G Wireless Optical Gaming Mice with Nano USB Receiver, 3 Adjustable DPI Levels, Click Silent Mouse for Notebook, PC, Laptop, Computer, MacBook - Black",B08GX47NCG,,1194,Computer,4.88 x 3.43 x 1.77 ,0.512,2020-08-28,,,,,,,,,,,,,,,,,,,
"Lenovo 300 Wireless Compact Mouse, Black, 1000 dpi, Ultra-portable design, Up to 12 months battery life, GX30K79402",B01MXFA41N,Lenovo,843,Computer,1.26 x 2.2 x 3.86,0.672,2016-11-11,No,GX30K79402,1 AA batteries required. (included),,GX30K79402,,,,,,,,,Black,,,,,
Macally Wireless Bluetooth Mouse Rechargeable - Simple Workspace Necessity - Quiet Click Buttons and 300mAh Battery (Up to 3 Months) - Silent Wireless Mouse for Mac |PC|iOS|Android - DPI 800/1200/1600,B08CBC64S3,,686,Computer,7.44 x 4.37 x 1.69 ,0.736,2020-11-20,,BTTOPBAT,1 Lithium ion batteries required. (included),,,,,,,,,,,,,,,,
"Wireless Keyboard and Mouse, Jelly Comb 2.4G Slim Compact Quiet Small Keyboard and Mouse Combo for Windows, Laptop, PC, Notebook-Black and Gray",B07VKL2V2M,,56,Computer,14.53 x 5.2 x 1.46 ,2.096,2019-07-23,,,,,,,,,,,,,,,,,,,
Macally Wireless Bluetooth Mouse for Mac and PC - Quiet Click Buttons with Slim Comfortable Body - Silent Wireless Mouse with DPI 800/1200/1600 - Workflow Enhancing Bluetooth Computer Mouse (White),B088PBK51Q,,690,Computer,6.97 x 4.21 x 1.3 ,0.6559999999999999,2020-10-02,,BTDYNAMOUSEW,,,,,,,,,,,,,,,,,
Marphe Mouse Pad Green Pattern Headset Music Panda Mousepad Non-Slip Rubber Gaming Mouse Pad Rectangle Mouse Pads for Computers Laptop,B07MKH7H3S,Marphe,7803,Office,10.23 x 8.26 x 0.12,0.5376,2018-12-25,No,,,,,,,,,,,,,Rectangle 16,,,,,
Hard Travel Case for Logitech MX Ergo M575 Advanced Wireless Trackball Mouse by co2CREA (Case for Mouse),B075JF2S7H,,467,Computer,6 x 5 x 3,0.6368,2017-09-11,No,8541660705,,,,,,,,,,,,,,,,,
"Perixx PERIMICE-802B Wireless Bluetooth Mouse - Portable Design for Windows, iOS, and Android Tablet - Black Rubber Black",B06XVY5X46,Perixx,396,Computer,3.82 x 2.38 x 1.33,0.2816,2017-03-27,No,PERIMICE-802,2 AAA batteries required.,,,,,,,,,,,Black,,,,,
"RGB Lightweight Gaming Mouse, Programmable 7 Buttons, Ergonomic LED Backlit USB Gamer Mice Computer Laptop PC, for Windows Mac OS Linux, Pink",B08HGLZZJC,,4100,Video,7.2 x 4.17 x 0.51 ,0.456,2020-09-04,,,,,,,,,,,,,,,,,,,
Blue Lotus Flower Round Mouse Pad Personalized Design Mouse Pads Small Size Non-Slip Rubber Base Mousepad for Laptop & Computer,B08RC7864X,,12167,Office,7.9 x 7.9 x 0.12,0.35200000000000004,2020-12-26,,,,,,,,,,,,,,,,,,,
HIHUHEN Large Mouse pad | Gaming Mouse Mat/Mouse Pad 23.6x11.8x0.12 Inch | Table mat/Large Size | Improved Precision and Speed | Rubber Base for Stable Grip on Smooth Surfaces Non-Slip (60x30Black004),B07T45YNFM,,5396,Office,12.1 x 2.5 x 1.8 ,1.7919999999999998,2019-04-24,,,,,,,,,,,,,,,,,,,
"Large RGB Gaming Mouse Pad - REAWUL 14 Modes Oversized Glowing Led Extended Mousepad, Anti-Slip Rubber Base and Waterproof Surface, Extra Large Soft Led Computer Keyboard Mouse Mat - 31.5 x 11.8in",B07SRS4PYR,REAWUL,4098,Office,31.5 x 11.8 x 0.2,1.54,2019-06-09,,RWMP-003,,,,,,,,,,,,Black,,,,,
"Wireless Portable Mobile Mouse Optical Mice with USB Receiver, 3 Adjustable DPI Levels, Buttons for Notebook, PC, Laptop, Computer -Black",B08MQ9GMP2,,1206,Computer,4.37 x 2.6 x 1.65 ,0.384,2020-11-04,,,,,,,,,,,,,,,,,,,
Razer Firefly Hard V2 RGB Gaming Mouse Pad: Customizable Chroma Lighting - Built-in Cable Management - Balanced Control & Speed - Non-Slip Rubber Base,B07ZDWHL4M,Razer,484,Video,10.84 x 13.99 x 0.14,1.7,2019-10-30,No,RZ02-03020100-R3U1,,,Firefly V2 Hard,,,,,,,,,Black,,,,,
Star Wars Mouse Pad Office Mouse Pad Gaming Mouse Pad Mat Mouse Pad,B08L6TFK3W,,22129,Office,9.45 x 7.87 x 0.1,0.16,2017-07-24,,KK-Mouse pad,,,,,,,,,,,,,,,,,
"Cute Kids Mouse Pad, Rose Gold Marble Mouse Pads for Girls Wireless Office Laptop Computer Desk Mousepad with Designs Decorative for Women",B08Q9SNY72,IMAYONDIA,6864,Office,9.5 x 7.9 x 0.12,0.8320000000000001,2020-12-10,,,,,,,,,,,,,,Rose Gold Marble,,,,,
"Wireless Keyboard and Mouse Combo, WisFox 2.4G Full-Size Slim Thin Wireless Keyboard Mouse for Windows, Computer, Desktop, PC, Laptop Mac (Black)",B07XXNJX9C,,51,Computer,16.13 x 4.7 x 0.8,1.44,2019-09-15,,,,,,,,,,,,,,,,,,,
"USB Computer Mouse Wired, Light Up Mouse for Laptop with RGB 7 Colors Breathing Light,4 DPI Adjustable up to 3200, 6 Buttons, Ergonomic Gamer PC Mouse for Windows/Mac/Sega Dreamcast（M738）",B07VFMNLWM,,2726,Video,5.91 x 4.41 x 1.85 ,1.168,2019-08-05,,,,,,,,,,,,,,,,,,,
"Lenovo GX30M39704 300 - Mouse - Right And Left-Handed - Wired - Usb - For 320 Touch-15, 320-14, 320-17, 520-22, 520-24, 520-27, 720-18, Legion Y520-15, V110-15 black",B073BRXPZX,Lenovo,252,Computer,4.39 x 1.33 x 2.45,0.128,2017-06-26,No,GX30M39704,,,,,,,,,,,,Black,,,,,
"Left-Handed Mouse, Jelly Comb Wireless 2.4GHz Left Hand Ergonomic Vertical Mouse with USB Receiver, Sensitive and Quiet Click MV09E",B07Q7G5ML6,,313,Computer,4.3 x 2.6 x 2.2,0.384,2019-03-27,,MV09E,,,,,,,,,,,,,,,,,
"RGB 89 Keys Gaming Keyboard and Colorful Mouse Combo,USB Wired LED Backlight Gaming Keyboard and Mouse Set for Laptop PC Computer Game and Work,Right Numeric Keys,Letter Glow",B08FDCH6MT,,3508,Video,15.75 x 6.3 x 3.15,2.2,2019-11-03,,,,,,,,,,,,,,,,,,,
"Mouse Pad,Upgraded Mouse Pad with Durable Stitched Edge,11.8""x9.8""x0.12"" 30% Larger Big Gaming Black Mouse pad,Non-Slip Rubber Base Waterproof Mouse Pad for Gaming,Laptop,Computer, Office,Home, Black",B088GYHSRX,,33707,Office,11.81 x 9.84 x 0.12,0.6144,2020-08-18,,Mouse Pad,,,,,,,,,,,,,,,,,
"YOOMAS Mouse Pad Marble Design with Non-Slip Rubber Base with Skin-Friendly Stitched Edges, Micro-Textured Mouse Pad for Gaming, Laptops, Office & Home, 9.5 x 7.9 Inch - White/Gold",B08NX29DTK,,11604,Office,10.2 x 8.82 x 0.67 ,1.01,2020-11-20,,,,,,,,,,,,,,,,,,,
"Ergonomic Mouse Pad Wrist Rests Support, Non Slip Mousepads with Gel Cushion Wrist Support,iVeze Comfortable Durable Mouse Pads for Home Office Efficient Working Easy Typing & Pain Relief (Galaxy)",B0816CVB2T,IVeze,5555,Office,11.38 x 8.7 x 1.1 ,0.7040000000000001,2019-11-07,,,,,,,,,,,,,,Galaxy,,,,,
"VicTsing Bluetooth Mouse for Laptop, Computer Mouse with Silent Click & Metal Scroll Wheel & 5 Levels DPI, Ultra Slim Portable Computer Mice for Notebook PC Computer Android Windows Mac",B082WRHKLT,VicTsing,508,Computer,4.41 x 2.56 x 1.38,0.44,2019-12-18,,AV121911,,,,,,,,,,,,Gray,,,,,
"Wireless Keyboard and Mouse, Jelly Comb 2.4G Ultra Slim Wireless Keyboard Mouse Combo with 12 Multi-Media Keys and Auto Sleep for Windows/Computer/PC/Laptop/Desktop-Black and Red",B08K91L4F8,,220,Computer,17 x 5 x 1.2,1.25,2020-09-28,,,,,,,,,,,,,,,,,,,
"OMOTON iPad Keyboard and Mouse, Bluetooth Keyboard and Mouse(iPadOS 13 and Above) for iPad 8th/7th Generation10.2, iPad Air 4/3, iPad Pro 12.9/11, and Other Bluetooth Enabled Devices",B089M73SSX,,157,Computer,13.7 x 4.84 x 4.7,1.2,2020-05-09,,,,,,,,,,,,,,,,,,,
"Round Mouse Pad with Stitched Edge Premium-Textured Non-Slip Rubber Base Mouse Mat Mousepad for Office & Home, Black (8.0 x 8.0 x 0.12Inch)",B08BR8G1QP,TNY,16220,Office,7.9 x 7.9 x 0.3 ,0.3824,2020-06-24,,,,,,,,,,,,,,,,,,,
"J-Tech Digital Wired Ergonomic Vertical USB Mouse with Adjustable Sensitivity (600/1000/1600 DPI), Scroll Endurance, Removable Palm Rest & Thumb Buttons [V628]",B0759V6FZC,,1065,Video,3.9 x 3.74 x 5.83,1.536,2015-01-05,No,V628,,,,,,,,,,,,,,,,,
"NYF Baby Yo-Da Mouse Pad Rectangle Rubber Non-Slip Mouse Pad Personalized Gaming Mouse Pads for Laptop Computer 11.8"" x 9.8""",B08L5DQZBP,NYF,19717,Office,12.01 x 9.84 x 0.2,0.672,2020-10-13,,,,,,,,,,,,,,Baby Yo-da 2,,,,,
Mafiti Wired Gaming Keyboard Mouse Combo USB Backlit LED Keyboards RGB Mice 3200DPI Compatible with PC Laptop Desktop Computer for Business Office,B07H27CKQ1,,79,Computer,16.93 x 5.12 x 0.79,1.65,2018-11-21,No,RK101 -US -Mafiti,,,,,,,,,,,,,,,,,
"Logitech MX518 Gaming-Grade Optical Mouse PC Mouse, PC/Mac, 2 Ways",B07NDVF9V7,Logitech,2314,Video,2.84 x 4.72 x 1.71,1.12,2019-10-11,,910-005545,1 AA batteries required.,,MX518 Gaming-Grade Optical Mouse,,,,,,,,,,,,,,
Naruto Custom Mouse Pad Anime Mouse Mat Home Office Computer Gaming Mousepad,B08LPFJC81,Vaweyaw,9003,Office,11.85 x 11.18 x 1.14 ,2.1919999999999997,2020-10-23,,,,,,,,,,,,,,Black10,,,,,
"Macally USB Wired Keyboard and Mouse Combo Bundle - Simple & Easy to Use Ultra Slim Keyboard Mouse Combo - Compatible with Windows 10/8/7/Vista/Xp, etc. - Plug & Play",B07R853R1P,,137,Computer,17.8 x 9.3 x 1.5 ,1.8,2019-05-02,,DDKEYCOMBO,,,,,,,,,,,,,,,,,
"ZJFKSDYX MK87 Wireless RGB Mechanical Keyboard and Mouse-Support Charging (Blue Switch, Black)",B089FMTMFS,,7459,Video,17.44 x 6.38 x 2.01 ,2.54,2020-05-30,No,,,,,,,,,,,,,,,,,,
"YOOMAS Extra Large Mouse Pad/Office Desk Keyboard & Mouse Mat with Stitched Edges, Rubber Base & Marble Print, Desktop Mat for Gaming, Office & Home, 11.81 x 31.5 inches - White/Gold",B08NX2F9J6,,11604,Office,12.2 x 2.83 x 2.76 ,1.1,2020-11-20,,,,,,,,,,,,,,,,,,,
Logitech M325 Wireless Mouse for Web Scrolling - Black,B007T1CTDE,,359,Computer,3.73 x 1.54 x 2.24,0.5247999999999999,2012-03-22,No,910-002974,2 A batteries required. (included),,,,,,,,,,,,,,,,
