name,ASIN,Brand,Best_Sellers_Rank,Best_Sellers_Ranking_Fields,Product_Dimensions_inches,Item_Weight_pounds,Date_First_Available,Is_Discontinued_By_Manufacturer,Item_model_number,Batteries,Voltage,Series,National_Stock_Number,Chipset_Brand,Batteries_Required,Wireless_Type,Standing_screen_display_size,Max_Screen_Resolution,Part_Number,Item_Package_Quantity,Color,Number_of_USB_2point0_Ports,Number_of_USB_3point0_Ports,Computer_Memory_Type,Average_Battery_Life_in_hours,Processor_Count
"Marvel Avengers End Game - Mouse Pad - 10""x8"" Non Slip",B07RF15DKV,INNOVA,28650,Office,9.5 x 4.6 x 0.5 ,0.3824,2019-05-02,,,,,,,,,,,,,,,,,,,
"Vassink Ergonomic Rechargeable Wireless Mouse, 2.4Hz Rechargeable Wireless Vertical Optical Mice with USB Receiver, 6 Buttons, 800/1200/1600 DPI RED",B087F57W93,,914,Computer,5.03 x 3.77 x 3.14 ,0.8640000000000001,2020-04-22,,,1 Lithium Polymer batteries required. (included),,,,,,,,,,,,,,,,
"RELIGES Upgrade Ergonomic Wrist Pad (2 Pack) - Mousepad Memory Foam Wrist Support Pillow Rest Cushion Mat for Office Computer Laptop, Mac Durable Comfortable and Pain Relief (Gray+Starry Sky)",B08PV7D79Q,RELIGES,20152,Office,5.12 x 2.76 x 1.18,0.816,2019-07-27,,WPD,,,,,,,,,,,,Gray+starry Sky,,,,,
"Wireless Mouse,Rii RM902 Rechargeable LED Slim Wireless Mouse 2.4G Silent Mouse with USB Receiver,Travel Mouse for Windows,MacBook,Notebook,Android,Mac",B08C9V5JVM,,1040,Computer,4.6 x 3.3 x 1.3 ,0.512,2020-07-03,,,1 Lithium ion batteries required. (included),,,,,,,,,,,,,,,,
"Ergonomic Mouse Pad with Wrist Support Gel Mouse Pad with Wrist Rest, Comfortable Computer Mouse Pad, Pain Relief Mousepad with Non-Slip Rubber Base for Office & Home + Cup Coaster, Chaos Coordinator",B08NFW2HC9,JStar,38703,Office,9.84 x 7.87 x 0.98,1.104,2020-11-14,,,,,,,,,,,,,,Chaos Coordinator,,,,,
"Bluetooth Mouse, Inphic Rechargeable Wireless Mouse Multi-Device (Tri-Mode: BT5.0/3.0+ 2.4G USB) Ultra-Slim and Silent , 1600DPI Portable Mouse for Mac MacBook Pro Tablet iPad OS, Green",B086SS1GVG,,530,Computer,4.72 x 3.07 x 1.34 ,0.38880000000000003,2020-04-16,,PM9BT,1 Lithium ion batteries required. (included),,,,,,,,,,,,,,,,
"Mouse Pad Dual Sided PU Leather Mouse Pad with Stitched Edge Waterproof Desk mat for Computers&Laptop,Office & Home, 8x10inch (Green&Grey)",B08DFKMPL5,,31646,Office,10.2 x 8.27 x 0.35 ,0.3776,2020-07-22,,,,,,,,,,,,,,,,,,,
"Round Mouse Pad and Coasters Set, African American Black Girl,Chic Hair,Big Eyes,Red Lips,Kiss Black Girl Mousepad, Non-Slip Rubber Round Mouse Pad, Customized Mouse Mat for Working and Gaming",B08GKKJ3G9,YAKAIER,66174,Office,7.9 x 7.9 x 0.1,0.2528,2020-08-24,,,,,,,,,,,,,,Ya-mouse Pad-2,,,,,
"Extended Gaming Mouse Pad, GIM Mouse Pad Large Size 3mm Thick Waterproof Mouse Mat Gaming Wide Long Functional Non-Slip Rubber Base and Black Edge (30.7 x 11.8 x 0.12 inches)-Luxury Black",B072K4DVTZ,,24402,Office,30.7 x 11.8 x 0.12,0.8959999999999999,2018-03-06,No,M-RE,,,,,,,,,,,,,,,,,
Ityracuv43n Po-K¨¦-Mon Pikachu Mouse Pad 10x12 in Anime Mouse Mat Gaming Mouse Pad (30x25cm),B08HN369KG,,91392,Office,0.1 x 0.1 x 0.1 ,0.00064,,,,,,,,,,,,,,,,,,,,
"Gaming Mouse Pad Custom, Basketball Ball in fire and Water Rectangle Non-Slip Rubber Mousepad 9.5 X 7.9 Inch (240mmX200mmX3mm)",B07HQGDS59,,54588,Office,9.45 x 7.87 x 0.12,0.2528,2018-09-27,No,,,,,,,,,,,,,,,,,,
"Wireless Keyboard and Mouse Combo, 2.4GHz Ergonomic Computer Keyboard and Wireless Mouse,USB Unifying Receiver,for PC Computer Laptop Windows,Quiet and Ergonomic,White",B08BZ8CD6V,,215,Computer,17.13 x 7.09 x 0.39,1.7,2020-06-29,,,,,,,,,,,,,,,,,,,
"Fellowes 5933901 Mouse Pad w/Microban, Nonskid Base, 9 x 8, Black (FEL5933901), 8"" x 9"" x 0.1""",B0002CE0WU,Fellowes,44167,Office,0.13 x 9 x 8,0.5632,2004-05-29,No,5933901,,,,,,,,,,,,Black,,,,,
"Wireless Computer Mouse,2.4G Wireless Optical Mouse with USB Receiver, Easy Click for Office and Home Mice,3 Adjustable DPI for Notebook, PC, Laptop, Computer, MacBook(Black)",B08K933FH6,,1098,Computer,4.57 x 2.8 x 1.69,0.46240000000000003,2020-09-28,,,1 Lithium ion batteries required. (included),,,,,,,,,,,,,,,,
TUNJILOOL 2 in 1 Double Sided Rectangle Mouse Pad 270x210x20mm PU Waterproof Leather Protective Writing Pad for Office Home (Light Blue/Sliver),B08PNWPML9,TUNJILOOL,87709,Office,10.63 x 8.31 x 0.24 ,0.4048,2020-12-04,,,,,,,,,,,,,,Light Blue/Sliver,,,,,
"Perixx Perimice-513L Wired Vertical Ergonomic Mouse with 2 DPI, 6 Button Optical Ergo Mouse with 2 Level DPI Switch 1000 1600, Left Handed, Black",B074W2D3HN,Perixx,998,Computer,6.29 x 8.25 x 2.95,0.8640000000000001,2017-08-17,No,11516,,,,,,,,,,,,Black,,,,,
"3 Pieces Marble Mouse Pad Waterproof Round Mouse Pad Non-Slip Rubber Base Mousepad for Office Home Most Computers Laptops 7.9 Inch, 3 Designs",B08RBF2C7Z,,144374,Office,8.27 x 8.27 x 1.18 ,1.056,2020-12-25,,,,,,,,,,,,,,,,,,,
"Dooke Mouse Pad with Stitched Edge, Premium-Textured Mouse Mat with Waterproof Non-Slip Rubber Base, Cute Round Mousepad for Laptop Computer Office Desk Accessories, 7.9 x 7.9 inch, Moon Eclipse",B08G4R7M28,Dooke,13055,Office,8.78 x 7.72 x 0.63 ,0.3552,2020-08-18,,,,,,,,,,,,,,Moon Eclipse,,,,,
"Calendar 2021, Seasons of Different Colo Mouse Pad Office Mouse Pad Gaming Mouse Pad Mat Mouse Pad",B07ST9XMFW,KiNGKANG,42338,Office,7.9 x 7.9 x 0.1,0.2048,2017-07-24,No,KK-Mouse pad,,,,,,,,,,,,Black,,,,,
"Chic ago Mouse Pad,Life Needs Sport Mousepad with Non-Slip Rubber Base for Laptop Computer Gaming Desktop Mat",B08FMPFNH3,,130079,Office,9.41 x 7.83 x 0.28 ,0.3824,2020-08-11,,SA050,,,,,,,,,,,,,,,,,
"Wireless Gaming Mouse Rechargeable,RGB Multi-Colour Backlit Game Mice with 7 Buttons Computer Accessories,2.4G Silent Optical,3 Adjustable DPI Game Mouse Power Saving Mode for Laptop/PC/Notebook",B087N6CBRY,,10185,Video,5.94 x 4.06 x 2.13 ,0.8,2020-04-25,,,,,,,,,,,,,,,,,,,
"ALOANES Mouse Pad with Stitched Edge, Premium-Textured Mouse Mat, Non-Slip Rubber Base Mousepad for Laptop, Computer & PC,Desk Mat for Gamer, Office & Home,Black(31.5''x11.81''x0.12'')",B08JYK88C6,,21882,Office,14.02 x 3.78 x 2.36 ,2.2880000000000003,2020-09-24,,,,,,,,,,,,,,,,,,,
ROLEES HD Bright Colors Gaming Mousepad Office Mousepad Natural Eco Rubber Durable Computer Desk Stationery Accessories Mouse Pads for Gift Rectangle Mousepad Non-Slip Rubber (American Flag),B088NHM5YC,ROLEES,61624,Office,10.5 x 8.8 x 0.1 ,0.10144,2020-05-15,,,,,,,,,,,,,,American Flag,,,,,
"ShhhMouse Wireless Ergonomic Mouse for Laptop & Computer with USB, Silent Cordless Mice with 3 Adjustable DPI Levels for Chromebook (Black)",B016NA3UPW,,836,Computer,5.1 x 2.8 x 2.5,0.64,2015-12-02,No,shhhmouse,2 AA batteries required. (included),,,,,,,,,,,,,,,,
"Pricetail Mouse Pad, Pretty Mouse Pads with Design, Purple Starry Mandala Round Mouse Pad, Premium-Textured Non-Slip Rubber Base Mouse Pads, for Office PC Computers Laptop, 7.9 x 7.9 x 0.1 Inch",B081SYJ5CT,Pricetail,24538,Office,8 x 7.5 x 0.1 ,0.3824,2019-11-20,,,,,,,,,,,,,,Purple Starry Mandala,,,,,
"Passion Sparks Dream, Life Needs Sports,Stay Positive Work Hard and Make It Happen Personalized Unique Design Non-Slip Rubber Blace Blue Gaming Mouse Pad",B087RGJZHF,,63288,Office,9.21 x 7.64 x 0.24 ,0.48960000000000004,2020-04-28,,,,,,,,,,,,,,,,,,,
"Sunny day Mouse Pad, Mousepad (Beaches Mouse Pad)",B00KJE5L92,,19858,Cell,11.5 x 1.1 x 5.8,0.1536,,Yes,RebeSON,,,,,,,,,,,,,,,,,
"BlueFinger Gaming Keyboard and Mouse,USB Wired Backlit Gaming Mouse and Keyboard Combo,Letters Glow, 3 Color Crack Backlit,Illumination Keyboard and Mouse Set for Game and Work",B015ISUG0M,BlueFinger,3024,Video,18.9 x 1.97 x 7.28,2.2,2015-09-18,No,200WY,,,,,,,,,,,,Keyboard + Mouse + Mousepad,,,,,
Pink Noiseless Click 2.4G Wireless Keyboard with Bluetooth 2.4G Dual Mode Mouse Quiet Typing 2-in-1 Portable Keyboard Mouse Combo,B08KZX695K,,383,Computer,15.07 x 5.2 x 1.46 ,2.528,2020-10-15,,,,,,,,,,,,,,,,,,,
"RGB Mouse Bungee, KAFRI Mice Cable Holder Rack with 1 Port USB Hub - Mouse Wire & Cord Management Support for Esports FPS Game, PC Gaming Accessories for Gamer",B087M8FW2F,,15401,Video,5.08 x 4.72 x 2.44 ,1.808,2020-04-23,,,,,,,,,,,,,,,,,,,
"Gaming Mouse with 5 D Rocker, TRELC Ergonomic Mouse with 10000 DPI/11 Programmable Buttons, RGB Vertical Gaming Mice Wired for PC/Laptop/E-Sports/Gamer (Black)",B07THFMNQ2,,3299,Video,4.8 x 3.4 x 3 ,1.1520000000000001,2019-06-24,,,,,,,,,,,,,,,,,,,
Mouse Pad with Wrist Rest - Memory Foam Mousepad Soft Comfortable Wrist Rest Support Square Mouse Mat,B07VVVCT5N,,29944,Office,6.3 x 9 x 0.6,1.168,2019-08-03,,,,,,,,,,,,,,,,,,,
Allsop Mouse Pad Pro Memory Foam Mouse Pad - Black (30203),B0036DDT5G,Allsop,32923,Office,10.8 x 10.55 x 1.3,0.9279999999999999,2010-02-01,No,ASP30203,1 Lithium ion batteries required.,,0035286302036,,,,,,,,,Black,,,,,
Mine_Craft Mouse Pad - Anti-Slip Waterproof Laptop Game Mouse Pad Mat for Kids Boys 11.81 x 9.84 x 0.12Inch,B08NSXH6ZC,,41873,Office,11.81 x 9.84 x 0.12,0.736,2020-11-18,,,,,,,,,,,,,,,,,,,
Curious Cat Flying Through Space Reaching for a Taco in Galaxy Space Hilarious Mouse Pad,B01CE6MF8W,Apottwal,44470,Office,1 x 1 x 0.1,0.512,2016-03-01,No,MP-0002,,,,,,,,,,,,1-cat,,,,,
R.I.P. Juice-Wrld-Legends Never Die Mousepad Gaming Mouse Pad Keyboard Ergonomic Mat Gamepad with Stitched Edge Wrist Support Rests Large Mouse Pad for Pc Computer Laptop 15.8x29.5 in,B08KQ74SNF,Leonner,76776,Office,15.71 x 12.01 x 1.1 ,1.17,2020-10-05,No,,,,,,,,,,,,,Black,,,,,
JNKPOAI Punisher Skull Mouse Pad,B08NNNJ37Y,,141239,Office,9.45 x 7.87 x 0.08 ,0.6559999999999999,2020-11-17,,,,,,,,,,,,,,,,,,,
"Cute Colorful Dinosaur Design Gaming Round Mouse pad for Kids Men Women Boys Girls, Mini Circular Mousepad for Desk Laptop Computer Home Office Working",B08JJ6V44G,Nasdalgias,29310,Office,7.87 x 7.79 x 0.55 ,0.3104,2020-09-19,,,,,,,,,,,,,,Colorful Dinosaur,,,,,
"Bluetooth Wireless Mouse, Jelly Comb 2.4GHz Wireless Bluetooth Mouse Dual Mode Portable Mobile Mouse with USB Receiver, 3 Adjustable DPI Level for Laptop, MacBook, PC, Windows, Android, OS System",B07XYMCTKK,,1906,Computer,4.96 x 3.39 x 1.65 ,0.6368,2019-09-17,,,,,,,,,,,,,,,,,,,
Round Gaming Mouse Pad Creative Custom Non-Slip Mouse Mat-Raiders,B07HZ2XJMF,Hero,48999,Office,9.45 x 7.87 x 0.12,0.2816,2018-10-03,,NF-K0037,,,,,,,,,,,,F0037,,,,,
"ITNRSIIET [35% Larger] Extended Gaming Mouse Pad with Stitched Edges XXL Mousepad 35.4x15.7 in Non-Slip Rubber Base Waterproof Keyboard Pad Mouse Mat for Work Office Home, Red Sun Rising",B089DHH6RS,ITNRSIIET,24787,Office,35.4 x 15.7 x 0.12,1.23,2020-05-29,,Red Sun Rising,,,,,,,,,,,,Red Sun Rising,,,,,
"BlueFinger 87 Keys Gaming Keyboard and Mouse Combo, RGB Rainbow Backlit Keyboard with Lighted Gaming Mouse, USB Wired Compact Tenkeyless Keyboard Set for PC Laptop Computer Gamer Work",B08PV23D57,,519,Computer,3.94 x 0.79 x 0.79 ,1.96,2020-12-07,,,,,,,,,,,,,,,,,,,
"Ergonomic Mouse Pad with Gel Wrist Rest Support, iLeadon Non-Slip Rubber Base Wrist Rest Pad for Home, Office Easy Typing & Pain Relief, Black Map",B07JZ5DGBX,ILeadon,9737,Office,10 x 9.1 x 0.6 ,0.3824,2018-07-30,No,,,,,,,,,,,,,Black Map,,,,,
"Maruse Italian Leather Mouse Pad for Home or Office Desktop, Handmade in Italy, Black",B077BBLR2Y,Maruse,27907,Office,10.16 x 7.72 x 0.04,1.68,2017-11-10,No,MP01,,,,,,,,,,,,Black,,,,,
CorkTec by The Cork Collective Eco-Friendly Natural Cork Mouse Pad (Walden Lake),B08DFKYP3M,,62014,Office,9.72 x 8.19 x 0.24 ,0.3392,2020-07-22,,,,,,,,,,,,,,,,,,,
"Mouse Pad with Wrist Rest Support - SJY Ergonomic Mouse Pad Mat, Memory Foam Mouse Mat for Office Work, Gaming and etc.- Gray",B08BJJLZSH,SJY,57602,Office,10.6 x 7.8 x 1.24 ,0.6368,2020-06-20,,,,,,,,,,,,,,Gray,,,,,
"Single Circular Blank Mouse Pad - Black - 7.87"" Round Diameter (200mm x 200mm x 3mm)",B07D316GD9,Pingpi,19495,Office,7.87 x 7.87 x 0.12,0.512,2018-05-15,No,Pingpi-RD-P9014,,,,,,,,,,,,PP-38,,,,,
"Manhattan Wireless Keyboard and Mouse Combo, with One 2.4 GHz USB-Dongle Connection for Both, Black 178990",B07C7B8RKW,,230,Computer,20.6 x 5.6 x 1.5,1.25,2018-11-16,No,178990,1 AA batteries required. (included),,,,,,,,,,,,,,,,
"Macally Wireless Keyboard and Mouse Combo Bundle for PC, Desktop Computer, Laptop, Notebook, ChromeBook - Ultra Slim Cordless Keyboard Mouse Combo Set, Compatible with Windows 10/8/7/Vista/XP, etc.",B07R21VMY7,,191,Computer,19.3 x 8.9 x 3.7 ,1.6,2019-04-22,,RFSSKEYCOMBO,1 AA batteries required.,,,,,,,,,,,,,,,,
"Miyaso Ergonomic Mouse Pad with Wrist Support, Cute Mouse Pads with Non-Slip Rubber Base for Home Office Working Studying Easy Typing & Pain Relief, Summer Flower",B07T71Z2W2,Miyaso,17955,Office,10 x 8 x 0.58 ,1.024,2019-06-17,,,,,,,,,,,,,,Summer Flower,,,,,
Wireless Foldable Arc Mouse Folding Bluetooth Touch Mice (Black),B08GYL47BC,,1216,Computer,5.24 x 2.17 x 0.47,0.3824,2019-12-29,,,1 Lithium Polymer batteries required.,,,,,,,,,,,,,,,,
"LED Rechargeable Bluetooth Mouse, Dual Mode Bluetooth and 2.4GHz Wireless Mouse Compatible for MacBook, Laptop, Windows, PC, Computer, Notebook, Mac，Android Tablet，Ipad Mouse (Black)",B08KPC86S7,,2100,Computer,4.9 x 2.9 x 1.4 ,0.5632,2020-10-04,,,1 Product Specific batteries required. (included),,,,,,,,,,,,,,,,
2021 Calendar Mouse Pad Mousepad Non-Slip Rubber Funny Cute Mat for Gaming and Gift-Dark Brown,B08M43TKL8,YTMYAN,43310,Office,9.3 x 8.1 x 0.1 ,0.00064,2020-10-28,,,,,,,,,,,,,,Dark Brown,,,,,
eLUUGIE Keyboard and Mouse Adapter for Nintendo Switch/PS4/PS4 Pro/PS4 Slim/Xbox one/Xbox one S/Xbox One X/PS3/PS3 Slim,B089CV1D8T,,1058,Computer,3.94 x 3.54 x 0.39,0.3824,2020-05-29,,,,,,,,,,,,,,,,,,,
"J-Tech Digital Wireless Ergonomic Vertical USB Mouse with Adjustable Sensitivity (600/1000/1600 DPI), Scroll Endurance, Removable Palm Rest & Thumb Buttons [V628P]",B07H9C1WM8,J-Tech Digital,516,Computer,5.5 x 3.5 x 4.2,1.328,2015-07-21,No,V628P,1 AA batteries required. (included),,,,,,,,,,,Black,,,,,
"Schoolsupplies Black cat in moonlight Mouse Pad, Mousepad (Cats Mouse Pad)",B01DBL69P4,,18550,Office,8.5 x 7 x 0.3,0.256,2016-03-23,No,BC64624,,,,,,,,,,,,,,,,,
"Gaming Mouse Pad Waterproof Mousepads for Laptop Desktop Computer,Size 9.6 X 8 INCH - Disney Mickey Mouse",B0823RBNR6,Ringqueens,101740,Office,9.6 x 8 x 0.1,0.2528,2019-11-28,,s002,,,,,,,,,,,,Cartoon2,,,,,
Classic Cute Character Gorgeous Color Scheme Unique Design Mouse Pad,B07YBFLX2T,MP MPAD PCASE,63783,Office,9.49 x 7.83 x 0.24 ,0.456,2019-09-24,,,,,,,,,,,,,,1,,,,,
"Mini Kitty Mouse Pad with Gel Wrist Support, Ergonomic Mouse Pad Wrist Rest with Bar Set Non-Slip Pu Base for Computer Laptop Work Gaming Typing Pain Relief Gift Black Pink Blue",B08977WY2D,Mini Kitty,84614,Office,9.06 x 7.6 x 0.12,0.5312,2020-05-27,,B9Y838D33F1454A9F,,,,,,,,,,,,Black,,,,,
"MageGee G10 Gaming Mouse Wired, 7 Colors Breathing LED Backlit Gaming Mouse, 6 Adjustable DPI (up to 3200 DPI), Ergonomic Optical Computer Mouse with 7 Buttons for Windows PC Gamers",B0899M611P,,10698,Video,5.31 x 3.66 x 1.89 ,0.8959999999999999,2020-05-28,,,,,,,,,,,,,,,,,,,
Cool Black Knight Awesome Soldier Classic Movie Unique Design Customized Rectangle Gaming Black Mouse Pad,B07QV6NCKM,Manslator,59138,Office,9.25 x 7.87 x 0.39 ,0.5632,2019-04-19,,Manslator9112,,,,,,,,,,,,1,,,,,
Mouse Pad with Wrist Support - Ergonomic Mouse Pad with Wrist Rest Support Gaming Memory Foam Mousepad Mat with Non Slip Rubber Base for Computer Laptop Home and Office (Black),B08NQ2HSCW,,91659,Office,12.7 x 9 x 0.2 ,0.848,2020-11-17,,,,,,,,,,,,,,,,,,,
"BlueFinger Backlit Gaming Keyboard and Mouse Combo,USB Wired Backlit Keyboard Mouse Game Set,Multimedia Keys,3 Color LED Crack Illumination Keyboard Mouse for Game and Work",B015MKFGRY,BlueFinger,257,Computer,18.9 x 1.97 x 7.28,2.4,2015-09-21,No,Blue1717-1,,,,,,,,,,,,M100,,,,,
"Desk Pad, Desk Mat, Mouse Mat, XL Desk Pads Dual-Sided Purple/Red, 31.5"" x 15.7"" + 8""x11"" PU Leather Mouse Pad 2 Pack Waterproof, Mouse Pad for Laptop, Home Office Table Protector Blotter Gifts",B08HCZLTZ1,INNÔPLUS,9240,Office,16.54 x 2.56 x 2.52 ,1.12,2020-09-03,,,,,,,,,,,,,,Purple/Rose Red,,,,,
Large Gaming Mouse Pad Desk Mat Protector 35.4x15.7IN & Non- Slip Extended Smooth Mouse Mat Blotter Comfortable Writing Surface (90x40 biaohei),B07RZZQFR3,,18330,Office,17.01 x 3.7 x 3.66 ,1.85,2019-05-22,,,,,,,,,,,,,,,,,,,
"3D Anime Wrist Support Mousepad - Cartoon Non-Slip Gaming Mouse Pads, Silicone Anime Cute Girl Mouse Mat for Computer, Laptop",B08GLFVKQ5,YHENYCT,34654,Office,11.1 x 10.43 x 1.22 ,1.6640000000000001,2020-08-25,,MD6-SP8,,,,,,,,,,,,,,,,,
"Gaming Mouse Pad,Cute Mouse Mat with Design,Waterproof and Non-Slip Rubber Base Office Mousepad,Middle Size 9.45x 7.87 x 0.08 Inch,Cute Hulk Print Colour",B08J8C9XMR,Texly,55314,Office,9.45 x 7.87 x 0.08,0.46240000000000003,2020-09-16,No,GF-20-08E,,,,,,,,,,,,Cute Hulk Print,,,,,
Microsoft Compact Optical Mouse 500 - Black,B00080DSEM,,1236,Computer,3.44 x 1.88 x 0.98,1.104,2005-06-06,No,U81-00009,,,,,,,,,,,,,,,,,
"Anime Large Gaming Mouse Pad XL,Durable Mousepad with Anti-Skid Rubber Base & Stitched Anti-Fray Edges,Waterproof-Smooth Surface Mouse Mat,Desk Pad,Great for Laptop Computer & PC 11.8x23.6x0.12 inch",B08FMQDHCB,,90144,Office,12.05 x 1.73 x 1.61 ,1.696,2020-08-11,,,,,,,,,,,,,,,,,,,
Non-Slip Rubber Mousepad Ouija Board Mouse Pad Retro Ouija Board Mouse Pad 180mm x 220mm x 2mm,B00XSYOX9O,,14512,Office,11.5 x 1.1 x 5.8,0.1536,2015-05-17,No,ntfdfh,,,,,,,,,,,,,,,,,
"HAOCOO Ergonomic Mouse Pad with Wrist Support, Non-Slip Base Gel Mouse Pad Wrist Rest, Easy-Typing and Pain Relief for Home Office Computer Laptop(Black&Gold Marble)",B08MFFMZWX,HAOCOO,59979,Office,10 x 8 x 0.5 ,0.672,2020-11-04,,,,,,,,,,,,,,Black&gold Marble,,,,,
"Large Gaming Mouse Pad, BviFioX Extended Large Mouse Pad with Premium Textured Cloth, Non-Slip Rubber Base, Waterproof, Thick Foldable Mat for Office, Home&Gamer (Black-9040)",B08P4GSZ6P,,75182,Office,16.77 x 2.72 x 2.09 ,1.26,2020-11-25,,,,,,,,,,,,,,,,,,,
"Mouse Pad for Kids, Educational Fun Colorful Infographic Computer Mousepad for Boys & Girls, Non-Slip Rubber Based, Perfect Remote Learning Designs for Children (United States Map)",B08LV3M6Y2,Designer Desk,32769,Office,8.7 x 7 x 0.2 ,0.512,2020-10-26,,,,,,,,,,,,,,United States Map,,,,,
"WAVEYU Cute Gaming Mouse Pad for Kids Girls with Wrist Support, Funny Unicorn Ergonomic Mouse Pad for Wireless Mouse for Home Office Working Computers Laptop Easy Typing & Pain Relief, Kawaii Pink",B08G14W98Y,WAVEYU,19656,Office,9.45 x 1.73 x 0.24 ,0.672,2020-08-16,,,,,,,,,,,,,,Cute Unicorn,,,,,
"Aiphamy Mouse Pad with Stitched Edge, Small Round Mousepad, Non-Slip Rubber Base for Office Home Laptop Computer, 7.9 inches (Pink Cat)",B08JYVYSQZ,,35774,Office,10.55 x 7.83 x 0.16 ,0.33280000000000004,2020-09-24,,,,,,,,,,,,,,,,,,,
"Antner 12V Hand Warmer Mouse Pad with Timing Switch and 4 Gears Temperature Adjustable Winter Heated Mouse Mat, Gray",B08K7JBCKY,Antner,12567,Office,10.12 x 9.17 x 2.28 ,2.144,2020-08-01,,,,,,,,,,,,,,Gray,,,,,
Anime Naruto Gaming Mouse Pad 9.8X11.8X0.12 Inch Stitched Edges Waterproof Mousepad Pixel-Perfect Mouse Mat,B08CKRVDCB,Baofu,85277,Office,9.57 x 5.83 x 0.28 ,0.72,2020-07-08,,,,,,,,,,,,,,,,,,,
"Wireless Mouse Rechargeable, Inphic Silent Click 2.4G Cordless Mouse 1600DPI Slim Portable PC Computer Laptop Wireless Mice with USB Receiver for Windows Mac MacBook, Silver",B07PBFMS75,,801,Computer,4.33 x 2.36 x 0.79,0.40159999999999996,2020-04-20,,PM9,1 Lithium ion batteries required. (included),,,,,,,,,,,,,,,,
"Wireless Optical Pocket Rechargeable Pen Mouse,2.4G USB with UCB-C & Micro-USB Adapter,Suitable for Both Right Hand and Left Hand.1000 DPI Ergonomic RGB Backlit Mini Mice for PC Notebook Mac (Grey)",B08CXFZMFH,,1261,Computer,6.5 x 3.7 x 1.4 ,0.512,2020-07-13,No,,1 Lithium ion batteries required.,,,,,,,,,,,,,,,,
Office Mousepad with Gel Wrist Support - Ergonomic Gaming Desktop Mouse Pad Wrist Rest - Design Gamepad Mat Rubber Base for Laptop Comquter -Silicone Non-Slip Special-Textured Surface (Pink),B08N5DVFGF,,9402,Office,10.7 x 8.1 x 0.3 ,0.512,2020-11-11,,,,,,,,,,,,,,,,,,,
"Logitech C-U0007 Unifying Receiver for Mouse and Keyboard Works with Any Logitech Product That Display The Unifying Logo (Orange Star, Connects up to 6 Devices)",B0058OU8VY,Logitech,6,Bluetooth,0.75 x 0.6 x 0.25,0.0512,2011-06-29,No,LGH_C-U0007,,,C-U0007,,,,,,,,,,,,,,
"Tulichid Computer Wireless Mouse Rechargeable, 2.4G Noiseless Ergonomic Mouse with USB Nano Receiver and 3 Adjustable DPI /6 Button Computer Mouse for Laptop PC MacBook Desktop Green",B08BHRJQ7C,,330,Computer,5 x 3.2 x 1.9 ,0.768,2020-06-19,,CP864m-green,,,,,,,,,,,,,,,,,
"BKLNOG Wireless Car Mouse [Updated] with LED Headlights, 1600 DPI Sports Car Shaped Mouse for Mac, Computers, Red",B07FYGJ2D9,,12793,Video,4.8 x 2.9 x 1.9 ,0.384,2018-08-15,No,H121-RD,,,,,,,,,,,,,,,,,
"Keyboard Wrist Rest Mouse Pad Wrist Support,Memory Foam Ergonomic Wrist Pain Relief Non Slip Rubber Base Lightweight and Easy Typing for Home Gaming Office Computer Mac MacBook Pro Laptop,2 Pack,Black",B0839B6D8W,AODOOR,14922,Office,16.6 x 10.2 x 1.5 ,1.28,2019-12-30,,,,,,,,,,,,,,Black,,,,,
"Keyboard Wrist Rest + Mouse Pad + Mouse Wrist Rest Support Set, Memory Foam, Easy Typing Pain Relief, 3Pcs Keyboard Mouse Pad Set for Computer, Laptop, Home & Office",B07RQ6JWGR,,2265,Office,17 x 3.3 x 1,1.536,2019-05-25,No,Y199201,,,,,,,,,,,,,,,,,
"Metal Aluminum Mouse pad, Smooth Magical Ultra-Thin Hard Mouse pad for Office and Games, Double-Sided Waterproof, Fast and Precise Control of Laptop and Personal Computer Metal Mouse pad (Silver",B08FMS7Q8F,,55858,Office,8.66 x 7.09 x 0.08,0.5648,2020-08-12,,,,,,,,,,,,,,,,,,,
"Zhanghua Naruto Gaming Mouse Pad, Square Mouse Pad, Non-Slip Rubber Mouse Pad, Durable Stitched Edge, Suitable for Office Lapto",B08JGT56J1,Zhanghua,48931,Office,11.61 x 9.88 x 0.39 ,0.672,2020-09-12,,,,,,,,,,,,,,White,,,,,
ITNRSIIET [20% Larger] Mouse Pad with Stitched Edge Premium-Textured Mouse Mat Waterproof Non-Slip Rubber Base Round Floral Mousepad for Laptop PC Office 8.7×8.7×0.12 inches Chrysanthemum Flower Green,B089DDRQWV,ITNRSIIET,10211,Office,8.7 x 8.7 x 0.12,0.10144,2020-05-29,,Chrysanthemum Flower Green,,,,,,,,,,,,Chrysanthemum Flower Green,,,,,
"Auhoahsil Large Mouse Pad, Full Desk XXL Extended Gaming Mouse Pad 35"" X 15"", Waterproof Desk Mat with Stitched Edges, Non-Slip Laptop Computer Keyboard Mousepad for Office and Home, Galaxy Design",B08L153LYL,Auhoahsil,8712,Office,15.8 x 5 x 5,1.39,2020-10-10,,,,,,,,,,,,,,Amazing Galaxy,,,,,
"Cimetech Mouse Pad with Stitched Edge, Water-Resistant, Premium-Textured Mouse Mat, Non-Slip Rubber Base Mousepad for Laptop, Computer & PC, 10.6×8.3×0.1 inches (Black)",B07W5YFM4D,Cimetech,10492,Office,10.5 x 8 x 0.3 ,0.6368,2020-03-11,,,,,,,,,,,,,,Black 1PCS,,,,,
"Rechargeable Wireless Mouse, 2.4G Slim Mute Silent Click Noiseless Optical Mouse with USB Receiver Type-C Compatible with for Laptop, Computer, MacBook, Notebook, PC (Black)",B088YKPZLZ,,894,Computer,4.9 x 3.1 x 1.3 ,0.368,2020-05-20,,,,,,,,,,,,,,,,,,,
"Perixx11568 Perimice-717 Wireless Trackball Mouse, Build-in 1.34 Inch Trackball with Pointing Feature, 5 Programmable Buttons, 2 DPI Level, Black",B07CPYDJ6F,Perixx,750,Computer,6.29 x 8.25 x 2.28,0.752,2018-04-27,No,11568,2 AAA batteries required.,,,,,,,,,,,Black,,,,,
Mandalorian Baby Yoda Mousepad Laptop Round Gaming Mouse Pad Waterproof Non-Slip Mouse Pads Premium for Office Family Games 7.9x7.9 Inch,B08Q7PQHKY,SHISHANGNX,48007,Office,2 x 2 x 0.1 ,0.46240000000000003,2020-12-10,,,,,,,,,,,,,,Mand-alorian Baby Yo-da,,,,,
"Lenovo 4X30M39458 Combo Wl Keyboard Mice Wrls,Black",B06WGR9LXP,Lenovo,158,Computer,6.69 x 20.87 x 1.97,1.0,2017-02-16,No,4X30M39458,2 AAA batteries required. (included),,,,,,,,,,,Black,,,,,
"Extended Gaming Mouse Pad for World of Warcraft Horde Large Mousepad,Mouse Mat for Gamer,Office & Home (Horde)",B08KVSTD9F,Bylan,75790,Office,27.56 x 11.81 x 0.1,1.92,2020-10-08,No,,,,,,,,,,,,,Horde,,,,,
"Full Grain Leather Mouse Pad Durable Rectangular Desk Mat (7.87x9.84 inches, Chestnut)",B0848Y1CTQ,,37614,Office,8 x 1.85 x 1.85 ,0.6368,2019-10-03,,,,,,,,,,,,,,,,,,,
Janllow Among Us Rubber Round Mouse Pad 7.9x7.9 Inches Non Slip Perfect for Working and Gaming 1 Pcs,B08MLNK74Y,,89428,Office,7.87 x 7.68 x 0.28 ,0.3376,,,,,,,,,,,,,,,,,,,,
"ITNRSIIET Gaming Mouse Pad Custom for Home and Office, Colorful Pineapple Design for Women Non-Slip Rubber Thick Mouse Pad for Computers Desktops, PC, Laptop",B07WNNKDSY,ITNRSIIET,3408,Office,8.74 x 7.8 x 0.43 ,0.344,2019-08-20,,Coloured Pineapple,,,,,,,,,,,,Coloured Pineapple,,,,,
"Wireless Number Pad and Mouse, Jelly Comb 2.4G Wireless Numeric Keypad Mouse Ten-Key with Multi-Function 18 Round Keys for Laptop Desktop Notebook N042 - Just One USB Port (Black)",B07PLXLZBW,,7,Numeric,6.3 x 5.7 x 1.3,1.232,2019-03-12,,8541661357,,,,,,,,,,,,,,,,,
"Wireless Bluetooth Mouse 2.4G Hollow Out Gaming Mice with Nano USB Receiver Rechargeable Silent,3 Adjustable DPI Levels for Notebook,PC,Laptop,Computer,MacBook System 13.4",B08FTGZTZT,,1147,Computer,4.92 x 3.35 x 1.77,0.736,2019-10-29,,,1 Lithium Polymer batteries required.,,,,,,,,,,,,,,,,
"HAVIT Mechanical Keyboard Mouse Headset Kit, Blue Switch Keyboards,Gaming Mouse & RGB Headphones for Laptop Computer PC Games",B07WC141LZ,,1865,Video,17.05 x 4.88 x 1.38,3.3,2019-07-09,No,HV-KB380L-B-US,,,,,,,,,,,,,,,,,
"Sublimation Blank Mouse Pads for Heat Press, 10pcs 9.4"" x 7.9"" x0.12"" Blanks Rectangular Mousepads, Sublimation Blank for Heat Press Printing White Blank Mouse Pads",B088ZVPQP1,,14842,Office,9.5 x 8 x 1.6 ,1.87,2020-05-21,,,,,,,,,,,,,,,,,,,
"ZYF Z10 Air Mouse Remote, 2.4G Backlit Voice Remote Control with Wireless Keyboard Touchpad, Anti-Lost Function, for Nvidia Shield, Android TV Box, PC, Projector, HTPC - White",B08FFRXM41,,227,Computer,7.5 x 2.1 x 0.4,0.6144,2020-08-08,No,Z10-W,1 Lithium ion batteries required. (included),,,,,,,,,,,,,,,,
Rechargeable Wireless Mouse for MacBook pro Bluetooth Mouse for MacBook pro Air Laptop MacBook Mac Windows (Gray＋White),B07VGZN7G7,,1301,Computer,4 x 2 x 0.7,0.4864,2019-12-16,,,1 A batteries required. (included),,,,,,,,,,,,,,,,
