name,ASIN,Brand,Best_Sellers_Rank,Best_Sellers_Ranking_Fields,Product_Dimensions_inches,Item_Weight_pounds,Date_First_Available,Is_Discontinued_By_Manufacturer,Item_model_number,Batteries,Voltage,Series,National_Stock_Number,Chipset_Brand,Batteries_Required,Wireless_Type,Standing_screen_display_size,Max_Screen_Resolution,Part_Number,Item_Package_Quantity,Color,Number_of_USB_2point0_Ports,Number_of_USB_3point0_Ports,Computer_Memory_Type,Average_Battery_Life_in_hours,Processor_Count
"87 Keys Gaming Keyboard and Mouse Combo, USB Wired Rainbow Keyboard and Lightweight RGB Gaming Mouse , 6400 DPI Adjustable, 6 Programmed Buttons, for Laptop PC Computer Game and Work",B08CS9TNH6,,17728,Video,17.24 x 6.38 x 2.32 ,1.57,2019-09-12,,,,,,,,,,,,,,,,,,,
"USB RGB Gaming Keyboard and Mouse Combo, GT817 104 Key Rainbow Backlit Keyboard and Mouse Set, Computer Keyboard USB Wired Mouse for Windows PC Gamers (RGB Backlit)",B088D2CSPC,,622,Computer,21.81 x 9.02 x 1.73 ,2.44,2019-07-24,,,,,,,,,,,,,,,,,,,
Gwolves Hati HTM Stardust (Limited Edition) Ultra Lightweight Honeycomb Design Wired Gaming Mouse up to 16000 DPI - 3389 Performance Sensor - (58g) (Blue Sky),B08RBNJDTM,,19708,Video,7.4 x 5.16 x 2.36 ,0.32799999999999996,2020-12-26,,,,,,,,,,,,,,,,,,,
Cute Alien Baby Design Poster Mouse Pad Cool Mat Mouse for Gaming Non-Slip Base,B08NHHV58J,JIU21YOU,78264,Office,11.57 x 9.96 x 0.28 ,0.7040000000000001,2020-11-15,,,,,,,,,,,,,,Cute Alien Baby Design-8,,,,,
"Gold Stars MousePads Cute Mouse Pad with Stitched Edges, Comfortable Cloth Washable Non-Slip Rubber Base Mouse mat for Office Laptop Computer Travel 9.5""x7.9""x0.12""",B08Q857Q48,Xiao,109501,Office,9.5 x 7.9 x 0.12 ,0.536,2020-12-10,,,,,,,,,,,,,,8,,,,,
"Fellowes Memory Foam Mouse Pad/Wrist Rest, Black (9176501)",B000UH9M3E,Fellowes,34721,Office,9.25 x 7.94 x 1,1.104,2004-09-01,No,9176501,,,,,,,,,,,,Black,,,,,
RGB Mouse Pad Large Anti Slip Mouse Pad Extended Desk Pad Mice Pads with Non-Slip Rubber Base Led Mouse Pad Gaming Office Desk Mouse Mat Tech Mouse Pad (A),B088BHH5K8,Holeke,63741,Office,31.49 x 12 x 0.12,1.19,2020-05-08,,,,,,,,,,,,,,A,,,,,
Mand-alorian Baby Yoda Mouse Pad with Stitched Edge Non-Slip Waterproof Rubber Base Large MousePads for Laptops Computers and PC,B08Q83YV47,SHISHANGNX,48104,Office,11.8 x 9.6 x 0.2 ,0.768,2020-12-10,,,,,,,,,,,,,,Mand-alorian Yo-da Ba-by-9,,,,,
"Wireless Mini Mouse M187, Pocket Sized Portable Mouse for Laptops, Blossom",B07CDSC261,,774,Computer,3.22 x 1.25 x 1.94,0.2928,2018-05-10,No,910-005364,1 AAA batteries required. (included),,,,,,,,,,,,,,,,
One Piece Anime Mouse Pad Gaming Mouse Pad Mousepad for Adults Teens Office Supplies Mouse Mat 9.8x11.8x0.12inch,B08BKQW6DH,Easterm,45311,Office,11.81 x 9.84 x 0.12 ,0.768,2020-06-21,,,,,,,,,,,,,,,,,,,
Royal Up Mermaid Tail Custom Mouse Pad Gaming Mat Keyboard Pad Waterproof Material Non-Slip Personalized Rectangle Mouse pad (9.4x7.8x0.08Inch),B076X2ZPZM,Royal Up,66817,Office,9.45 x 7.87 x 0.08,0.3072,2017-06-01,No,8541655243,,,,,,,,,,,,Rectangle-15,,,,,
Farm Animals Chicken Mouse Pad Funny Quote Rise and Shine Mother Cluckers Watercolor Floral Mousepad Gift for Mom Farmer Gifts,B07QLJBGV6,Tamoxu,38265,Office,9.53 x 7.8 x 0.28 ,0.5920000000000001,2019-05-29,,,,,,,,,,,,,,1,,,,,
Castle Mouse Pad Non-Slip Rubber Base Gaming MousePads Anime Funny Cute Mouse Mat for Computers Laptop Office,B08K7HTHN8,DUADELI,31068,Office,9.5 x 7.9 x 0.12 ,0.46240000000000003,2020-09-27,,,,,,,,,,,,,,Castle,,,,,
"3D Anime Mouse Pads Silicone Wrist Rest Frog Mousepads Gel Mouse Pad with Wrist Support Silicone Anime Mouse Mat for Computer, Laptop",B08PCX1MLJ,,62035,Office,10.63 x 8.66 x 1.18 ,1.584,2020-12-01,,,,,,,,,,,,,,,,,,,
"Smooffly Funny Quotes Mouse Pad, Some Days, The Best Thing About My Job is That The Chair Spins Non-Slip Rubber Mousepad Gaming Mouse Pad",B07C7K1GDV,,61062,Office,9.45 x 7.87 x 0.12,0.4672,2018-04-16,,8541655705,,,,,,,,,,,,,,,,,
Weelth 2 in 1 Double Sided Round Mouse Pad 220x220x22mm PU Waterproof Leather Protective Writing Pad for Office Home(Light Blue/Sliver),B08GKHJKSM,Weelth,41485,Office,8.66 x 8.66 x 0.16 ,0.2256,2020-10-14,,,,,,,,,,,,,,Light Blue/Sliver,,,,,
"Rechargeable Wireless Keyboard and Mouse Combo, Ergonomic Metal Panel Keyboard with LED Backlight, 4-Color LED Backlight Optical Mice with Side Button, Easy to Clean, Anti-wear, for Office and Games",B08DP4NMR5,,423,Computer,17.32 x 5.31 x 1.38,2.64,2020-05-12,No,T600,,,,,,,,,,,,,,,,,
Cmhoo XXL Gaming Mouse Mat Extended & Extra Large Mouse Pad (8040 Map),B01IR37TXM,Cmhoo,9625,Office,31.5 x 15.7 x 0.1,1.536,2016-07-20,No,chengmenghe,,,,,,,,,,,,80*40 Map,,,,,
"Sadocom 2.4GHz Wireless Optical Mouse Pen, Handwriting Pocket Pen Mouse, Adjustable 800/1200/1600 DPI with Type C and Micro USB Adapter, Ergonomic Mice for PC Laptop Tablet Mobile Phone (red)",B08NW232H1,,2630,Computer,5.5 x 0.8 x 0.6,0.2256,2020-11-19,,,,,,,,,,,,,,,,,,,
Galaxy Universe Stars Outer Space Mouse Pads Customized Made to Order Support Ready 9 7/8 Inch (250mm) X 7 7/8 Inch (200mm) X 1/16 Inch (2mm) Eco Friendly Cloth with Neoprene Rubber Luxlady Mouse Pad Desktop Mousepad Laptop Mousepads Comfortable Computer Mouse Mat Cute Gaming Mouse pad,B00KH95S74,Mouse Pad,23904,Office,11.5 x 1.1 x 5.8,0.16,2014-05-20,Yes,Sdu2628,,,,,,,,,,,,Picture Color,,,,,
"Wireless Mouse 2.4G Portable Mobile Optical Iron Man Mouse with USB Nano Receiver, 3 Adjustable DPI Levels, 6 Buttons for Notebook, PC, Laptop, Computer, MacBook - Gold",B083MBVV4K,,1480,Computer,5.5 x 3.75 x 1.75 ,0.3824,2020-01-08,,,,,,,,,,,,,,,,,,,
"Ergonomic Mouse, Hommie Bluetooth 4.0 Rechargeable 2.4GHz Wireless Vertical Optical Mice, 5 Adjustable DPI 800/1200/1600/2000/2400 Levels 7 Buttons for Laptop/PC/Desktop/MacBook, Black",B08BNKBK8N,,1109,Computer,4.9 x 3.7 x 3.1 ,0.12960000000000002,2020-06-23,,,1 Lithium Polymer batteries required. (included),,,,,,,,,,,,,,,,
"Giant Chocolate Chip Cookie,Circle Non-Slip Rubber Mouse Pad, Mouse Pad,Funny,Coworker Gift Teacher Gift,Food Mouse mat",B08HZ614LK,XHY,73065,Office,7.87 x 7.76 x 0.71 ,0.2816,2020-09-14,,,,,,,,,,,,,,Food07,,,,,
"Sadie Mae Mouse Pad Hero Style Anti-Slip Rubber Mouse Pad with Durable Stitched Edges for Gaming Office Laptop Computer,Rectangle 3D Print Cool Custom Pattern-10x12inch",B08L49NRCP,,73493,Office,11.5 x 10 x 0.2 ,0.6368,,,,,,,,,,,,,,,,,,,,
"3D Mouse Pad Anime Wrist Support - Mouse Mat Wrist Rest Support, 3D Gel Anime Girl Mouse Pad with Wrist Rest Support Cute (Anime Mouse pad)",B08GKFTD7R,Miwaimao,89513,Office,10.2 x 8.7 x 0.2,1.808,2020-08-24,,,,,,,,,,,,,,,,,,,
"AUKEY Knight Gaming Mouse, RGB Wired Gaming Mouse with 10000 DPI, 8 Programmable Buttons, RGB Lighting Effects, Macros, Fire Button Gaming Mice for PC and Mac",B086GHVVGS,AUKEY,7868,Video,10 x 5.7 x 1.9 ,0.9920000000000001,2020-03-27,,,,,,,,,,,,,,RGB,,,,,
"Wired Lightweight Gaming Mouse,6 RGB Backlit Mouse with 7 Buttons Programmable Driver,6400DPI Computer Mouse,Ultralight Honeycomb Shell Ultraweave Cable Mouse for PC Gamers,Xbox,PS4(White)",B08PTVHFB5,,3961,Computer,5.91 x 2.76 x 1.57 ,0.38880000000000003,2020-12-07,,,,,,,,,,,,,,,,,,,
Rectangle Non-Slip Rubber Mousepad Gaming Mouse Pad/Mat-Mickey Mouse,B088DWSL2S,XHY,149498,Office,9.1 x 7.9 x 0.2 ,0.3824,2020-05-10,,,,,,,,,,,,,,,,,,,
"Demon Slayer Mouse Pad Large Extended Anime Gaming Mousepad, Non-Slip Water-Resistant Mouse Mat(35.4""x15.7"")",B08BK6LY6W,Mouse Pads,60381,Office,16 x 3.5 x 2.6 ,1.3,2020-06-20,,,,,,,,,,,,,,Demon Slayer-b,,,,,
dealzEpic - Art Mousepad - Natural Rubber Mouse Pad with Famous Painting of Skull of a Skeleton with Burning Cigarette by Vincent Van Gogh - Stitched Edges - 9.5x7.9 inches,B073B36BRX,DealzEpic,42326,Office,9.41 x 7.8 x 0.31 ,0.6368,2017-07-21,No,MOUSEPAD-SKELETON-24x20,,,,,,,,,,,,Skeleton with Burning Cigarette,,,,,
"Harley Davidson Game Mouse pad, Computer Mouse pad, Smooth Surface, Non-Slip Base, 25x30 cm",B08JPQBZ3C,,89966,Office,11.65 x 9.88 x 0.35 ,0.736,2020-09-22,,,,,,,,,,,,,,,,,,,
"Smooffly Gaming Mouse Pad Custom,Cute Sloths and Tropical Palm Leaves Mousepad Non-Slip Rubber Rectangle Mouse Pads for Computers Laptop",B07TLZB88W,Smooffly,32561,Office,9.45 x 7.87 x 0.12,0.47840000000000005,2019-06-28,,SMGM-MP6300,,,,,,,,,,,,Gm-61,,,,,
Claude Monet Water Lilies VI Mouse Pad with Colorful Classic Artwork Design. Non Slip Base. Matching Microfiber Cleaning Cloth for Eye Glasses & Electronics. Cool Mouse Pad for Laptop & Travel,B07GB8FYP7,One In A Millionaire,53826,Office,9.45 x 10.24 x 0.12,0.5920000000000001,2018-08-09,No,MP-RF-003,,,,,,,,,,,,Claude Monet Water Lilies VI,,,,,
"OTCEO Mouse Pad, Round Mandala Mouse Mat, Cute Mouse Pad with Design, Non-Slip Rubber Base Mousepad,Waterproof Office Mouse Pad, Small Size-Rose Gold Marble Heart White",B07VVY57BY,OTCEO,61547,Office,8 x 8 x 0.2 ,0.2528,2019-08-03,,OTCMO062260,,,,,,,,,,,,Tb60,,,,,
Always Remember You are Braver Than You Think Inspirational Quotes Vintage Wood Wall Art Unique Design Gaming Mouse Pad,B07RZPYBMY,Tmoschops,70094,Office,9.6 x 8 x 0.2 ,0.512,2019-05-21,,TMP076,,,,,,,,,,,,2,,,,,
Big Gaming Mouse Pads Non-Sliding Rubber Bottom Mouse Mat Desk Accessories Gift for Her Desk Decor (Houston),B08GJZ8S73,Plotery,145637,Office,11.81 x 9.84 x 0.12,0.848,2020-08-23,,Wi2020-0126,,,,,,,,,,,,Color2,,,,,
"Corsair Ironclaw Wireless RGB - FPS and MOBA Gaming Mouse - 18,000 DPI Optical Sensor - Sub-1 ms SLIPSTREAM Wireless",B07Q424WFW,Corsair,1623,Video,5.12 x 3.15 x 1.77,0.736,2019-04-25,No,CH-9317011-NA,1 Lithium Polymer batteries required. (included),,IRONCLAW RGB WIRELESS Gaming Mouse,,,,,,,,,,,,,,
"DETUOSI Mouse Pad, Gaming Mouse Pad Large Size XXL (31.50""L×11.81""W×0.08""H), Smooth Fabric Surface & Non-Slip Rubber Base,Thick Extended Large Desk Mat Keyboard Mouse Pad Durable Stitched Edges #Black",B07XHL4W3C,DETUOSI,39524,Office,31.5 x 11.81 x 0.12,2.48,2020-04-28,,#MA07740TYCAMFN,,,,,,,,,,,,Black,,,,,
Very Original Trendy Illustration on Mouse pad with Black and White Buffalo Check Plaids,B07D55PCDF,SSOIU,24262,Office,9.45 x 7.87 x 0.12,0.46240000000000003,2018-05-18,,,,,,,,,,,,,,Ss-06,,,,,
"Wireless Keyboard and Mouse Combo Ultra Silent, Topmate 2.4G Wireless Slim Keyboard and 3 DPI Levels Mouse, Full Size 107 Keys Office Keyboard Mouse for Windows, Mac OS, Laptop, PC",B08JYT9BHX,,306,Computer,17.72 x 8.23 x 1.65 ,1.18,2020-09-24,,KM22,2 AAA batteries required. (included),,,,,,,,,,,,,,,,
"Wireless Mouse for Computer, USB 2.4G Portable Office Mouse, 3 Adjustable DPI Levels, Slim Silent Comfortable Mouse for Laptop, Desk PC, MacBook, Notebook, Chromebook (Black) (Black)",B08DY3BK7T,,2270,Computer,4.1 x 2.6 x 1.6 ,0.3824,2020-07-30,,,,,,,,,,,,,,,,,,,
UOOPOO Black And Gold Hustle Mouse Pad Rectangle Non-Slip Rubber Personalized Mousepad Gaming Mouse Pads 8.2 x 10.2 x 0.12 Inch(Pattern: Print),B0769KGTRK,UOOPOO-US,56137,Office,10.16 x 8.27 x 0.16 ,0.6144,2017-10-09,,,,,,,,,,,,,,Color19,,,,,
"Ocadux 2 Pack Extended Mouse Pads, XL Large Mousepad with Stitched Edges, Mouse Mat for Gamer, Office and Home, 31.5x11.8x0.12 inch, Black",B08BL9ZMSP,,71766,Office,31.5 x 11.8 x 0.12,1.79,2020-07-25,No,B021,,,,,,,,,,,,,,,,,
"Fellowes Photo Gel Mouse Pad and Wrist Rest with Microban Protection, Sandy Beach (9179301), Blue, 9.25"" x 7.31""",B004TLJUWU,Fellowes,18635,Office,0.88 x 7.88 x 9.25,1.696,2011-03-24,No,9179301,,,,,,,,,,,,Blue,,,,,
"Apollo Gaming Extended Mouse Pad, Large NASA Astronaut Space Design Microfiber Mousepad, (31.5×11.8), Large XXL Extended Desk Mat. Long Computer Keyboard Mouse Mat Mousepad for Office/Gaming/Home",B07VHH8MP3,,65681,Office,31.5 x 11.81 x 0.12,1.0,2019-07-22,,Mission_Apollo_800_300_3,,,,,,,,,,,,,,,,,
Kensington Orbit Trackball Mouse (K64327EU),B000HEW0KW,,10,Computer,7.9 x 6 x 1.7,1.52,2004-06-29,No,K64327EU,,,,,,,,,,,,,,,,,
"ASLNSONG Large Gaming Mouse Pad One Piece 24""x12"" XL Extended Mat Desk Pad Rubber Mice Pads",B07Q7FVPNH,,44402,Office,12 x 2.1 x 1.6 ,1.6640000000000001,2019-03-28,,,,,,,,,,,,,,,,,,,
"Gaming Mouse Pad Large Extended Mouse Mat with Stitched Edge Desk Mat for Laptop Computer Desktop PC Gamer Office and Home Non-Slip Rubber Mousepad (27.5"" x 11.8"" Map)",B08JYBFH8Y,,16508,Office,27.56 x 11.81 x 0.1,1.584,2020-09-24,,,,,,,,,,,,,,,,,,,
"HK Gaming Mira M Ultra Lightweight Honeycomb Shell Wired RGB Gaming Mouse - Up to 12 000 cpi | 6 Buttons - 63g Only (Mira-M, Metallic Blue)",B0876BK6WZ,,5765,Video,4.88 x 2.52 x 1.57,0.3552,2020-04-16,No,Mira-M,,,,,,,,,,,,,,,,,
"Wireless Optical Mouse,2.4G Handwriting Pen Mouse Portable PPT clicker with Type C OTG Micro USB OTG Adapter fit for MacBook Tablet PC Laptop Mobile Phone",B07SS48HPT,,68,Digital,5.51 x 0.98 x 0.79,0.2528,2019-06-24,,PR-03,1 AAA batteries required.,,,,,,,,,,,,,,,,
"Rechargeable 2.4GHz Wireless Bluetooth Mouse, Wireless Mouse for MacBook Pro Mac Air,Blluetooth Mouse for ipad Notebook Tablet Computer (Black)",B082ZMHGBS,,2643,Computer,4 x 2 x 0.7,0.512,2020-02-29,,996068,,,,,,,,,,,,,,,,,
My Hero Academia Mouse Pad Anime Mouse Pad Waterproof Non-Slip Mouse Pads for Computers 9.8x12x0.12inch,B087PYTJX7,YANG,58796,Office,11.73 x 9.8 x 0.39 ,0.8,2020-04-27,,MP-00003,,,,,,,,,,,,,,,,,
"5 Pack 2mm Mouse Pad with Non-Slip Rubber Base, Premium-Textured and Waterproof Mousepads Bulk, Mouse Pad for Computers, Laptop, Office & Home (210 x 173 x 2mm , Black)",B01BLFBNBM,SaiTech IT,59523,Office,8.86 x 7.8 x 0.91 ,0.2304,2016-02-09,No,3mm Mouse Pad Surface -5 pack,,,,,,,,,,,,Black,,,,,
"Mouse Pad with Stitched Edges, Premium-Textured Mousepad Non-Slip Rubber Mouse Mat for Office Gaming Dorm Computer Laptop Travel 9.4×7.9×0.12 Inch",B08NBZG38P,,70162,Office,9.72 x 9.69 x 0.43 ,0.5632,2020-11-12,,KM-SBD-06XKL006-American Dj Skull,,,,,,,,,,,,,,,,,
"3D Cute Anime Cat Mouse Pads with Silicon Wrist Rest, Gaming Mousepads, Comfy Mousepad, Mouse mat, Manga Design Mousepad, Funny Mousepads",B08MYYQS53,,70938,Office,10.28 x 8.46 x 1.54 ,1.632,2020-11-08,,,,,,,,,,,,,,,,,,,
"Ergonomic Mouse Pad, Sexy Gaming Mouse Pad with Wrist Support, 3D Anime Mouse Pads & Wrist Rests with Non-Slip Base, Desk Mat for Laptop Computer, Gamer, Office, Home & Funny Gifts",B087RKQL13,,45421,Office,11 x 11 x 1 ,1.6640000000000001,2020-04-28,,19axa8e0fa94fb,,,,,,,,,,,,,,,,,
Amcove Personalized Horse with Foal Mouse Pad Customized Rectangle Non-Slip Rubber Mousepad Gaming Mouse Pads,B08CZR1TSV,Amcove,60873,Office,9.45 x 7.87 x 0.12,0.5072,2020-07-15,,Amcove-MP-3295,,,,,,,,,,,,Am03,,,,,
WKX Dual Sided Desk Pad Office Desk Mat Leather Desk Blotter Laptop Desk Mat Computers Mouse Pad Waterproof Writing Pad for Office and Home(31.5” x 15.7”) Two-Color (Pink l.Blue),B08FZJ5LW7,WKX,61853,Office,31.5 x 15.75 x 0.08,1.01,2020-08-16,,,,,,,,,,,,,,Pink L.blue,,,,,
SYMSPAD Jurassic Park Mousepad 8.6 X 7.1 in,B07SQVL52K,SYMSPAD,41233,Office,8.75 x 8 x 0.18 ,0.3824,2019-06-04,,SYMSPAD0001,,,,,,,,,,,,A-6,,,,,
"Large Desk Mat Gaming Mouse Pad NX75D Table Protector Desktop Play Mat for Wired or Wireless Magic Mouse, Apple MacBook, Surface, Lenovo, Samsung Laptop, Office, Home & Web Cafe, Large Size - Black",B086WYR1GD,NOOX,29132,Office,11.81 x 1.97 x 1.97 ,2.096,2020-04-09,,NX752MP,,,,,,,,,,,,Black,,,,,
"Smooffly Forest Gaming Mouse Pad,National Park Nature Mountain Trees Mist Mouse Pad for Office 9.5 X 7.9 Inch (240mmX200mmX3mm)",B07C7D7ZSG,,59791,Office,9.45 x 7.87 x 0.12,0.4512,2018-04-16,,,,,,,,,,,,,,,,,,,
"Smooffly Life Quote Mouse Pad Custom,Always Remember You are Stronger Braver Smarter 9.5X7.9 inches Mouse Pad",B07C8C2Z38,,49143,Office,9.45 x 7.87 x 0.12,0.5072,2018-04-18,,,,,,,,,,,,,,,,,,,
"Extended Large Gaming Mouse Pad with Stitched Edges, XXL Mouse Pad Large (31.5x11.8 Inch) w/ Brilliant Design, Desk Mat Keyboard Pad with Anti Slip Base, Multifunctional Desk Pad - Galaxy Turtle",B08M3K1KWJ,Yeefanltd,34375,Office,31.5 x 11.8 x 0.12,1.7280000000000002,2020-10-29,,,,,,,,,,,,,,Galaxy Turtle,,,,,
"Havit Mechanical Keyboard and Mouse Combo Wired 89 Keys Backlit Gaming Keyboard Red Switch, 4800 D P I Mouse with 6 Button, Gaming Mouse Pad for PC Gamer Computer Laptop",B0861459MX,,2369,Video,17.51 x 6.81 x 2.32 ,2.57,2020-08-05,,,,,,,,,,,,,,,,,,,
"Foldable Bluetooth Keyboard, Jelly Comb Dual Mode Bluetooth & USB Wired Rechargable Portable Mini BT Wireless Keyboard with Touchpad Mouse for Android, Windows, PC, Tablet-Black",B07S9XZDGY,,98,Computer,6.73 x 4.13 x 1.65 ,1.584,2019-04-02,,,,,,,,,,,,,,,,,,,
Teacher Gifts Personalized Classroom Decor Teacher Gift Mouse Pad Teacher Appreciation Gift Teacher Gift for Teacher Gift Ideas Custom,B07FSWH5QX,Pingpi,18341,Office,9.45 x 7.87 x 0.12,0.512,2018-07-24,No,8541655995,,,,,,,,,,,,PP-74,,,,,
"Wireless Optical Pocket Pen Mouse,Promi 2.4 Ghz USB 3.0 Wireless Optical 2-in-1 Digital Pen Mouse & Adjustable 800/1200/1600 DPI,Ergonomic Mouse for MacBook Notebook Desktop (Red)",B07ZRJ2V8D,,947,Computer,6.54 x 3.62 x 1.34 ,0.2992,2019-10-30,,,,,,,,,,,,,,,,,,,
"De_spicable Me Mouse Pad - Custom Game Mouse Pads , Minion Mouse Pad,Non-Slip Mouse Mat with Delicate Edges,Personalized Mousepad for Kids Office Dorm Computer Laptop11.81 x 9.84 x 0.12Inch",B08P5DD4GZ,,201499,Office,11.81 x 9.84 x 0.12 ,0.736,2020-11-26,,,,,,,,,,,,,,,,,,,
"Memory Foam Mousepad with Wrist Support, Custom Bible Verse Pink Sparkles Glitter Pattern Mouse Pad Wrist Rest, Super Non-Slip PU Base",B07D9K4WDS,Apottwal,57870,Office,9.8 x 8 x 0.15,1.024,2018-05-25,No,,,,,,,,,,,,,,,,,,
"HAOCOO Desk Pad, Office Desk Mat 35.4"" ×15.7"" Large Gaming Mouse Pad Durable Extended Computer Mouse Pad Water-Resistant Thick Writing Pads with Non-Slip Rubber Base for Office Home(Summer Wildflower)",B08C4WN561,HAOCOO,4606,Office,16.14 x 3.46 x 2.09 ,1.25,2020-06-30,,,,,,,,,,,,,,Summer Wildflower,,,,,
Microsoft Basic Optical Mouse for Business - Black,B004MWVLY6,,1260,Computer,11.13 x 5.88 x 5.75,0.5232,2011-04-18,No,4YH-00007,1 Lithium ion batteries required.,,,,,,,,,,,,,,,,
"O'woda RGB Gaming Mouse Mat, 31.5 x 12 x 0.2 inch Large LED Mousepad with 14 Lighting Modes, Non-Slip Rubber Base & Smooth Surface Keyboard Pad for Computer, PC and Laptop (Geometric)",B088DBDCJ1,O'woda,57112,Office,12.9 x 3.8 x 3.6 ,1.55,2020-05-09,,,,,,,,,,,,,,Geometric,,,,,
JNKPOAI The Cartoon Mouse Pad with Various Styles The Simpsons Anti-Slip Mouse Pad Office Mouse Pad Computer Game Mouse Pad (The Simpsons),B08KRT7RG7,JNKPOAI,70438,Office,9.33 x 7.83 x 0.59 ,0.3824,2020-10-06,,,,,,,,,,,,,,The Simpsons,,,,,
"Avatar The Last Airbender Mouse Pad with Locking Edge Gaming Speed Version Medium Cloth Mouse Mat Non-Slip Rubber Base Mousepad for Laptop, Computer, PC, Keyboard",B082WRWDCJ,,108224,Office,11.77 x 9.76 x 0.24 ,0.2816,,,,,,,,,,,,,,,,,,,,
Universal USB Heated Mouse Pad Mat Winter Warm Plush Electric Hand Warmer with Wrist Guard(Pink),B07ZNZT51D,BRXY,86147,Office,11.69 x 8.66 x 1.02 ,0.9440000000000001,2019-10-28,,,,,,,,,,,,,,Pink,,,,,
"Logitech MK520 Wireless Keyboard and Mouse Combo — Keyboard and Mouse, Long Battery Life, Secure 2.4GHz Connectivity",B003VANO7C,,8186,Office,7.9 x 2.7 x 18.3,2.2,2010-07-09,No,920-002553,1 Lithium Metal batteries required.,,,,,,,,,,,,,,,,
"VESMATITY XXL Extended Mouse Pad Gaming Mouse Pads with Stitched Edges Computer Full Desk Large Mouse Pads Non-Slip Base Desk Mat for Gaming and Office (31.5x11.8x0.12In, Blue Marble Gold)",B08N4FPN5T,VESMATITY,55766,Office,11.8 x 2.75 x 2.75 ,2.256,2020-12-25,,,,,,,,,,,,,,Blue Marble Gold,,,,,
"Logitech G502 Hero High Performance Gaming Mouse Special Edition, Hero 16K Sensor, 16 000 DPI, RGB, Adjustable Weights, 11 Programmable Buttons, On-Board Memory, PC/Mac - Black/White",B07W7MQMD9,Logitech,1400,Video,2.95 x 1.57 x 5.2,1.456,2019-10-07,,910-005730,1 Lithium Polymer batteries required.,,G502 SE HERO Gaming Mouse,,,,,,,,,Black & White,,,,,
"Ergonomic Keyboard Wrist Rest and Mouse Pad with Wrist Support, SAMIT Memory Foam Mouse Cushion Anti-Slip Computer Wrist Rest Pad for Comfortable Typing Wrist Pain Relief (Keyboard Wrist Rest)",B0854FW5GM,SAMIT,34627,Office,17.52 x 5.59 x 2.48 ,1.4080000000000001,2020-02-25,,,,,,,,,,,,,,,,,,,
Perixx PERIMICE-518 Left Handed Mouse - Ergonomic Vertical Design - Wired - 5 Buttons - 1000/1600 DPI,B06XNJ657X,Perixx,2266,Computer,4.69 x 3.5 x 2.52,0.9440000000000001,2017-03-13,No,11410,,,,,,,,,,,,Black,,,,,
"Backlit Wireless Keyboard and Mouse - with Illuminated Keyboard, seenda Rechargeable Full-Sized Keyboard and Mouse Combo for Windows Computer, Laptop, Desktop, Chromebook",B08HSY2P1Z,,99,Computer,17.4 x 5.24 x 2.24 ,1.72,2020-09-11,,,,,,,,,,,,,,,,,,,
"Fellowes PlushTouch Mouse Pad/Wrist Rest with FoamFusion Technology, Black (9252001)",B008CO5VGE,Fellowes,31266,Office,9.38 x 7.25 x 1,1.28,2012-06-15,No,9252001,,,,,,,,,,,,Black,,,,,
Large Gaming Mouse pad with Nonslip Base Mouse pad Desk mat Waterproof Stitched Edge Desk pad XL Mousepad Anime Extended Mouse Pads for Computer (Red),B08D3L4N2J,Hokele,84604,Office,12.44 x 2.83 x 2.01 ,1.584,2020-07-16,,,,,,,,,,,,,,Red,,,,,
VESMATITY Round Mouse Pad Non-Slip Rubber Base Mousepad Custom Design Cute Mouse Pads with Stitched Edge for Computer Laptop Office Travel Working Gaming (8.7 inch - Planet Two),B08N4JMTZB,VESMATITY,70979,Office,8.66 x 8.66 x 0.12,0.4512,2020-10-26,,,,,,,,,,,,,,Planet Two,,,,,
"BYBART Mouse Pad, Gold Mandala Flower Round Non-Slip Rubber Mousepad Office Accessories Desk Decor Mouse Pads for Computers Laptop",B07R7F1ZMM,BYBART,4647,Office,7.9 x 7.9 x 0.12,0.3104,2019-04-26,,,,,,,,,,,,,,Mandala,,,,,
Large Mousepad 14167 Green Smoke Abstract Art Natural Eco Rubber Mousepad Design Durable Mouse Mat Computer Accessories Big Gaming Mouse Pad,B0135KHNYW,Mouse Pad,37334,Office,9.06 x 7.48 x 0.12,0.1536,2015-08-01,No,RebeSON,,,,,,,,,,,,,,,,,
"Vintage Wood Texture Background Passion Sparks Dream, Life Needs Sports Unique Design Non-Slip Rubber Gaming Mouse Pad",B07XRFCMN8,,112628,Office,9.5 x 8 x 0.3 ,0.5344,2019-09-11,,,,,,,,,,,,,,,,,,,
"Round Mouse Pad with Coasters Set, Thin Blue Line American Flag Design Mouse Pad, Non-Slip Rubber Base Mouse Pads for Laptop and Computer Office Accessories",B08JJCDK1K,Luasao,59742,Office,7.9 x 7.9 x 0.1,0.272,2020-09-19,,,,,,,,,,,,,,Thin Blue Line American Flag,,,,,
"Round Mouse Pad with Coasters Set, Rustic Old Wood Inspirational Quote Stay Positive Work Hard and Make It Happen Design Mouse Pad, Non-Slip Rubber Base Mouse Pads for Laptop and Computer",B08K7JPB4V,LOWORO,104511,Office,7.9 x 7.9 x 0.1,0.28800000000000003,2020-09-27,,,,,,,,,,,,,,Stay Positive Work Hard and Make It Happen,,,,,
Kraken Mouse Pad Sail Boat Waves and Octopus Non-Slip Rubber Mouse pad Gaming Mouse Pad by Smooffly,B07B9YQ77P,,71511,Office,9.45 x 7.87 x 0.12,0.4672,2018-03-08,No,8541655538,,,,,,,,,,,,,,,,,
"Amcove Scottish Highland Cattle Mouse pad,Highland Cow Mousepad - Mat - Rectangle - Black and White Steed - Mouse pad Co Worker Gift",B08CZRJSJ2,Amcove,58154,Office,9.45 x 7.87 x 0.12,0.5072,2020-07-15,,Amcove-MP-3413,,,,,,,,,,,,Am17,,,,,
"WFB Wireless Gaming Mouse Rechargeable Full Size Bluetooth Mice 2.4G with Nano USB Receiver,3 Adjustable DPI Levels,6 Buttons for Notebook,PC,Laptop,Computer,MacBook(Grey)",B089ZXXPV8,,20422,Video,5.94 x 3.46 x 2.05 ,1.072,2020-04-28,,,1 Lithium Polymer batteries required. (included),,,,,,,,,,,,,,,,
"ASUS ROG Gladius II Origin Wired USB Optical Ergonomic FPS Gaming Mouse featuring Aura Sync RGB, 12000 DPI Optical, 50G Acceleration, 250 IPS sensors and swappable Omron switches,Black",B078YBG1VZ,ASUS,3876,Video,5.51 x 2.76 x 8.66,1.52,2018-01-11,No,ROG Gladius II Origin,AA batteries required.,,ROG Gladius II Origin,,,,,,,,,Black,,,,,
Oriental Rug Mouse Pad - Turkish Style Carpet Mousemat - Great Gift (Pattern 1),B08GS31T16,Inusitus,71759,Office,10 x 7 x 0.1 ,0.512,2017-08-03,No,MP-NS-MIX,,,,,,,,,,,,Pattern 1,,,,,
"Rechargeable Bluetooth Mouse,SUNGI Slim Silent Mouse for iPad 13.1.2/ MacBook/ iPhone/ Tablet/ Laptop/ Notebook/ Chromebook, Compatible with iOS/Windows/Linux/Andriod,Black",B08C21J9DS,,1233,Computer,4.45 x 2.24 x 0.87,0.5072,2020-06-30,No,,,,,,,,,,,,,,,,,,
"Perixx PERIPRO-303 1.34 Inches Trackball - Replacement Ball for M570, PERIMICE-517/520/717/720, and Other Compatible Trackball Mouse (Yellow) (18040)",B0857K5255,Perixx,89,Computer,2.17 x 2.17 x 2.17,0.17600000000000002,2020-07-14,,18040,,,,,,,,,,,,Glossy Yellow,,,,,
Westlake Art - Starry Night Castle Night Boats - Mouse Pad - Non-Slip Rubber Abstract Artwork Home Office Computer Laptop PC Mac Mousepad 8x9 Inch (36D4F) (8x9 Inch),B07GDF5D63,Westlake art,30154,Office,9.29 x 7.72 x 0.59 ,0.64,2018-08-13,,36D4FE2DC2402DA41C700E255A4F66F0,,,,,,,,,,,,,,,,,
"SHrui Gaming Office Mouse pad,Anti-Slip Natural Rubber Mouse pad, Round Personalized Custom Mouse pad for Desktop, Computer, Laptop - Black Gold Marble",B07WVJ96NJ,SHruizhuo,23407,Office,8 x 8 x 0.5 ,0.3824,2019-08-24,,jkkns1,,,,,,,,,,,,Black Gold Marble,,,,,
Shuangyi - Flowers Round Mouse pad Customized Non Slip Rubber Round Mouse pad Non Slip Rubber Mouse pad Gaming Mouse Pad,B0714JY4RR,ABin,95721,Office,7.9 x 7.9 x 0.1,0.192,2017-03-11,No,,,,,,,,,,,,,Black,,,,,
"Spaced Out Mouse Pad with Stitched Edge, Premium-Textured Mouse Mat, Non-Slip Rubber Base Mousepad for Laptop, Computer & PC, 10.3x8.3x0.03 inch",B08GFV94QJ,TOLUYOQU,108760,Office,9.4 x 6.6 x 0.1 ,0.512,2020-08-21,,,,,,,,,,,,,,Spaced Out,,,,,
"TESHIUCK Wired Gaming Mouse with 8 Buttons,6800DPI,Breathing Backlit LED,USB Optical Games Mice for PC Computer Laptop Ps4 Gamer (Black)",B077L2TXKV,TESHIUCK,12791,Video,5.04 x 3.19 x 1.58,1.024,2018-02-20,No,wired gaming mouse,,,Usb wired gaming mouse,,,,,,,,,Black,,,,,
"Bluetooth Mouse, Slim Dual Mode(Bluetooth 4.0 + USB) 2.4GHz Wireless Mouse for Laptop, iPad, MacBook, PC- for Windows 8.0/ MacOS 10.10/ iPad OS 13/ Android 4.3 or Above (White)",B08BYLDK1X,,2208,Computer,4.92 x 2.99 x 1.34 ,0.5632,2020-06-28,,,1 Product Specific batteries required. (included),,,,,,,,,,,,,,,,
Goldblue Cat Paw Mouse Pad with Wrist Support Soft Silicone Wrist Rests Wrist Cushion Comfort Mouse Pad Computer Mouse Mat-Grey,B07QW57WJ4,,37657,Office,10.4 x 7.4 x 1.2 ,1.7919999999999998,,,F,,,,,,,,,,,,,,,,,
